asin,reviewerID,reviewerName,helpful,reviewText,overall,unixReviewTime,reviewTime,title,price,imUrl,salesRank,brand,categories
B007NCL4QC,A15PUBCS4N4G60,buckeyede06,"[0, 0]",I think these things worked just fine I haven't had any issues or anything like that. The even fit the small rubber case I have on my phone too,5.0,1348185600,"09 21, 2012",ipod/ iPhone (All versions) USB Charger Data Cable - White,4.16,http://ecx.images-amazon.com/images/I/31dIVtsdzTL._SY300_.jpg,{'Cell Phones & Accessories': 3859},Apple,"[['Cell Phones & Accessories', 'Accessories', 'Data Cables']]"
B007NCL4QC,A30QZ5R9QCT2C9,CC40,"[0, 0]",Cable charger quick working and this is poorly designed. Was so cheap I didnt bother asking for an exchange. c,3.0,1355443200,"12 14, 2012",ipod/ iPhone (All versions) USB Charger Data Cable - White,4.16,http://ecx.images-amazon.com/images/I/31dIVtsdzTL._SY300_.jpg,{'Cell Phones & Accessories': 3859},Apple,"[['Cell Phones & Accessories', 'Accessories', 'Data Cables']]"
B007NCL4QC,A3OUGCUZGUG1FF,Chels,"[2, 2]","This is an okay product. It does what it needs to to sync my ipod. Not the best quality, but whatever.It stopped working after a month. You get what you pay for.",3.0,1341446400,"07 5, 2012",ipod/ iPhone (All versions) USB Charger Data Cable - White,4.16,http://ecx.images-amazon.com/images/I/31dIVtsdzTL._SY300_.jpg,{'Cell Phones & Accessories': 3859},Apple,"[['Cell Phones & Accessories', 'Accessories', 'Data Cables']]"
B007NCL4QC,AEH6CWDFBH8S4,David Denovellis,"[0, 0]",You know immediately its is not original but it does the jobs for the car or when you go away. For the house I would pay for the original,4.0,1356912000,"12 31, 2012",ipod/ iPhone (All versions) USB Charger Data Cable - White,4.16,http://ecx.images-amazon.com/images/I/31dIVtsdzTL._SY300_.jpg,{'Cell Phones & Accessories': 3859},Apple,"[['Cell Phones & Accessories', 'Accessories', 'Data Cables']]"
B007NCL4QC,A2NY65HX407885,"Debbie A. Reynolds ""Mom of a DS Gamer""","[0, 0]",The original cord that came with our Ipod 4th Generation stopped charging the Ipod. I saw this cord for an excellent price and ordered it. It works just fine and we have had no problems charging it. It beats having to go to the Dealer and buying it for ten times more!  It was delivered fast too!,5.0,1341360000,"07 4, 2012",ipod/ iPhone (All versions) USB Charger Data Cable - White,4.16,http://ecx.images-amazon.com/images/I/31dIVtsdzTL._SY300_.jpg,{'Cell Phones & Accessories': 3859},Apple,"[['Cell Phones & Accessories', 'Accessories', 'Data Cables']]"
B007NCL4QC,A1SHHQSPOWR00F,"E ""--""","[0, 0]","Beware, as each of these cables appears to be made by different companies based on which seller you choose.Mine came from China and looks to be ""OEM"" from ""OEM Systems Company"" not necessarily from Apple.  I've used mine with an iPad, iPod, and iPhone.  It's flawless.",5.0,1341100800,"07 1, 2012",ipod/ iPhone (All versions) USB Charger Data Cable - White,4.16,http://ecx.images-amazon.com/images/I/31dIVtsdzTL._SY300_.jpg,{'Cell Phones & Accessories': 3859},Apple,"[['Cell Phones & Accessories', 'Accessories', 'Data Cables']]"
B007NCL4QC,A2TN29L9R3NB3L,Emily Whittaker,"[0, 0]","this charger worked for a while until one day it just stopped. the port fit and worked fine the shipping, price and quality was decent. it was the fact it didn't last long, AT ALL.",3.0,1384905600,"11 20, 2013",ipod/ iPhone (All versions) USB Charger Data Cable - White,4.16,http://ecx.images-amazon.com/images/I/31dIVtsdzTL._SY300_.jpg,{'Cell Phones & Accessories': 3859},Apple,"[['Cell Phones & Accessories', 'Accessories', 'Data Cables']]"
B007NCL4QC,A2AMMW2FXKK1GV,Gustavo Beltran,"[0, 0]","I works great for my iPod but it doesn't like my iPad3 for some reason , it does charge it but it takes 4 times longer than the factory cord does to charge",3.0,1360713600,"02 13, 2013",ipod/ iPhone (All versions) USB Charger Data Cable - White,4.16,http://ecx.images-amazon.com/images/I/31dIVtsdzTL._SY300_.jpg,{'Cell Phones & Accessories': 3859},Apple,"[['Cell Phones & Accessories', 'Accessories', 'Data Cables']]"
B007NCL4QC,A6NQEADSVHMFF,izaiah,"[0, 0]",at first it was not good but it al got better becuase they sent me another one and everything is alrightthank you,3.0,1373673600,"07 13, 2013",ipod/ iPhone (All versions) USB Charger Data Cable - White,4.16,http://ecx.images-amazon.com/images/I/31dIVtsdzTL._SY300_.jpg,{'Cell Phones & Accessories': 3859},Apple,"[['Cell Phones & Accessories', 'Accessories', 'Data Cables']]"
B007NCL4QC,A1744LW1BJD2HP,Jcentsi,"[1, 1]",So i ordered 4 of them. One didn't work. So now i have three. Out of the three only one charges my iPad. The other two are good for my iPhone. So they charge but aren't worth it in the long run,3.0,1347840000,"09 17, 2012",ipod/ iPhone (All versions) USB Charger Data Cable - White,4.16,http://ecx.images-amazon.com/images/I/31dIVtsdzTL._SY300_.jpg,{'Cell Phones & Accessories': 3859},Apple,"[['Cell Phones & Accessories', 'Accessories', 'Data Cables']]"
B007NCL4QC,A1JC2DSLYNUAKI,jeet patel,"[0, 0]",the wire broke within a couple weeks of use. it is not a long lasting product. it also has trouble fitting in the iphones,1.0,1362700800,"03 8, 2013",ipod/ iPhone (All versions) USB Charger Data Cable - White,4.16,http://ecx.images-amazon.com/images/I/31dIVtsdzTL._SY300_.jpg,{'Cell Phones & Accessories': 3859},Apple,"[['Cell Phones & Accessories', 'Accessories', 'Data Cables']]"
B007NCL4QC,A21WOESZQ6QEU4,Jon Snow,"[0, 0]","It sure looks like the original Apple sync cord.  It does work like it suppose to.  My problem is that the connection to my Apple devices is really tight.  In fact, the connection requires an extra push to be able to get it to seat properly.  So based on this issue  I would say that it's a close copy, but it is not an OEM item.  It does do the job, though.",4.0,1358553600,"01 19, 2013",ipod/ iPhone (All versions) USB Charger Data Cable - White,4.16,http://ecx.images-amazon.com/images/I/31dIVtsdzTL._SY300_.jpg,{'Cell Phones & Accessories': 3859},Apple,"[['Cell Phones & Accessories', 'Accessories', 'Data Cables']]"
B007NCL4QC,A2HNDNUJJBPO4Z,$LimP!ckins,"[0, 0]","I have gotten about ten of these over the years and only hit one that was a lemon. Considering the price difference between these and the OEM, there is no choice to make really... just order them, and if you hit a lemon, toss it, who cares? your still going to be way ahead on money in the end, by a lot. They look the part too... you cant tell the difference... i see a lot of picky reviews ... just from people that dont work in the industry and dont understand.",4.0,1355875200,"12 19, 2012",ipod/ iPhone (All versions) USB Charger Data Cable - White,4.16,http://ecx.images-amazon.com/images/I/31dIVtsdzTL._SY300_.jpg,{'Cell Phones & Accessories': 3859},Apple,"[['Cell Phones & Accessories', 'Accessories', 'Data Cables']]"
B007NCL4QC,A3645VL9T5KHGG,mrpatar,"[0, 0]",Looks just like the OEM ones but its cheaper. If this is what you need get one its a no brainer.,5.0,1366588800,"04 22, 2013",ipod/ iPhone (All versions) USB Charger Data Cable - White,4.16,http://ecx.images-amazon.com/images/I/31dIVtsdzTL._SY300_.jpg,{'Cell Phones & Accessories': 3859},Apple,"[['Cell Phones & Accessories', 'Accessories', 'Data Cables']]"
B007NCL4QC,A2Q4BL0E6WZSTE,"Pasha ""PMV""","[0, 0]","As all generic products, it's a hit or miss. It charges accessories, but is very touchy about whether it will sync them without a problem.",2.0,1369872000,"05 30, 2013",ipod/ iPhone (All versions) USB Charger Data Cable - White,4.16,http://ecx.images-amazon.com/images/I/31dIVtsdzTL._SY300_.jpg,{'Cell Phones & Accessories': 3859},Apple,"[['Cell Phones & Accessories', 'Accessories', 'Data Cables']]"
B007NCL4QC,A1A3T0P2ICPR3G,Sue,"[0, 0]","This charger looks just like my Apple charger.It started out working great, but after a few weeks it stopped charging my phone. I had to keep unplugging it & plugging it back in again.",2.0,1354579200,"12 4, 2012",ipod/ iPhone (All versions) USB Charger Data Cable - White,4.16,http://ecx.images-amazon.com/images/I/31dIVtsdzTL._SY300_.jpg,{'Cell Phones & Accessories': 3859},Apple,"[['Cell Phones & Accessories', 'Accessories', 'Data Cables']]"
B007NCL4QC,A2GB5ZO00HY0U0,Troy A. Morgan,"[0, 0]",Theses cables were ordered as replacements and they did the job. They are aftermarket so they are not going to work as well as the one you get from Apple.,4.0,1361923200,"02 27, 2013",ipod/ iPhone (All versions) USB Charger Data Cable - White,4.16,http://ecx.images-amazon.com/images/I/31dIVtsdzTL._SY300_.jpg,{'Cell Phones & Accessories': 3859},Apple,"[['Cell Phones & Accessories', 'Accessories', 'Data Cables']]"
B007NCL4QC,A1LRC8DZ3HCCWE,Vince,"[0, 0]",Looks and fits just as the Apple OEM original plug. Good quality. Compare to others where the plug base is larger than the original.,4.0,1356566400,"12 27, 2012",ipod/ iPhone (All versions) USB Charger Data Cable - White,4.16,http://ecx.images-amazon.com/images/I/31dIVtsdzTL._SY300_.jpg,{'Cell Phones & Accessories': 3859},Apple,"[['Cell Phones & Accessories', 'Accessories', 'Data Cables']]"
B007NCL4QC,A3JA9Y564YMWLF,visualizor,"[0, 0]",it is quite obvious that this is not the original apple usb cord. the coating is too smooth while the real apple cord has a grainy touch to it. doesnt feel as solid as the original ones. but this is way cheaper so its a trade off,3.0,1351814400,"11 2, 2012",ipod/ iPhone (All versions) USB Charger Data Cable - White,4.16,http://ecx.images-amazon.com/images/I/31dIVtsdzTL._SY300_.jpg,{'Cell Phones & Accessories': 3859},Apple,"[['Cell Phones & Accessories', 'Accessories', 'Data Cables']]"
B0089EA2NY,AO1JSCWEOAC34,"Abel Uribe ""SmartDisk""","[0, 0]","The Camera didn't work was a waste of time, effort and money will never purchase another product from them again.",1.0,1369785600,"05 29, 2013",New Apple iPhone 4S Back Rear 8MP Camera &amp; Flash Module with Flex Cable Genuine Replacement,3.44,http://ecx.images-amazon.com/images/I/41ct7UAR14L._SX300_.jpg,{'Cell Phones & Accessories': 8995},Apple,"[['Cell Phones & Accessories', 'Accessories', 'Replacement Parts']]"
B0089EA2NY,A6QBOCCTAZPFS,Ben parker,"[0, 0]",Everything works like it's supposed to I have nothing more to say you guys are boring me with all the questions,3.0,1393804800,"03 3, 2014",New Apple iPhone 4S Back Rear 8MP Camera &amp; Flash Module with Flex Cable Genuine Replacement,3.44,http://ecx.images-amazon.com/images/I/41ct7UAR14L._SX300_.jpg,{'Cell Phones & Accessories': 8995},Apple,"[['Cell Phones & Accessories', 'Accessories', 'Replacement Parts']]"
B0089EA2NY,A1AW5961VA4TLU,Georg,"[0, 2]","Works great, thanksNew Apple iPhone 4S Back Rear 8MP Camera & Flash Module with Flex... New Apple iPhone 4S Back Rear 8MP Camera & Flash Module with Flex...",5.0,1359849600,"02 3, 2013",New Apple iPhone 4S Back Rear 8MP Camera &amp; Flash Module with Flex Cable Genuine Replacement,3.44,http://ecx.images-amazon.com/images/I/41ct7UAR14L._SX300_.jpg,{'Cell Phones & Accessories': 8995},Apple,"[['Cell Phones & Accessories', 'Accessories', 'Replacement Parts']]"
B0089EA2NY,A2DO8B41AI21V1,gj83,"[1, 2]","I accidentally washed my phone and everything works fine except the flash just never goes off.  It stays at a faint illumination...even with the phone powered down.  It was nice because I could always find it in my purse, but not nice because I'm sure it's not good for the battery or phone.I purchased this camera and it installed easily enough without reading proper instructions.  I just unscrewed and pushed off the back.  Unscrewed the 4 screws (2 tiny and 2 little) on the metal plate above the connector, then removed the old camera and reversed the steps.  Easy peasy.  I took a couple pics and they turned out just fine and the flash works with the camera and works with my flashlight app...plus it no longer is constantly illuminated.",5.0,1377648000,"08 28, 2013",New Apple iPhone 4S Back Rear 8MP Camera &amp; Flash Module with Flex Cable Genuine Replacement,3.44,http://ecx.images-amazon.com/images/I/41ct7UAR14L._SX300_.jpg,{'Cell Phones & Accessories': 8995},Apple,"[['Cell Phones & Accessories', 'Accessories', 'Replacement Parts']]"
B0089EA2NY,AJAUC05LE2NM0,"Jeffrey S. Foster ""inluvwithamazon""","[0, 0]","My wife's camera on her iPhone 4S suddenly decided to quit focusing, after reading the reviews on this model, decided to give it a shot. Took me approximately 5 minutes or so to replace it, I already had the tools since I've replaced the battery in both of our phones. Easy fix, and a great product, it works like a charm!",5.0,1381622400,"10 13, 2013",New Apple iPhone 4S Back Rear 8MP Camera &amp; Flash Module with Flex Cable Genuine Replacement,3.44,http://ecx.images-amazon.com/images/I/41ct7UAR14L._SX300_.jpg,{'Cell Phones & Accessories': 8995},Apple,"[['Cell Phones & Accessories', 'Accessories', 'Replacement Parts']]"
B0089EA2NY,A1W67NB503WVQ9,Stacy,"[0, 0]",I needed to replace my camera on my iPhone since it was not focusing right.  Ordered this and received a couple of days later.  Switched it out and it worked great!!  Saved me from purchasing a whole new phone just to take photos!,5.0,1380153600,"09 26, 2013",New Apple iPhone 4S Back Rear 8MP Camera &amp; Flash Module with Flex Cable Genuine Replacement,3.44,http://ecx.images-amazon.com/images/I/41ct7UAR14L._SX300_.jpg,{'Cell Phones & Accessories': 8995},Apple,"[['Cell Phones & Accessories', 'Accessories', 'Replacement Parts']]"
B0089EA2NY,A3H18NHFIMWEML,Steve Jajonie,"[0, 0]","If you know your way around an iPhone, then I would recommend this product.  It is very easy to install and works great.  I have had it for a long time and its never failed me.",5.0,1396569600,"04 4, 2014",New Apple iPhone 4S Back Rear 8MP Camera &amp; Flash Module with Flex Cable Genuine Replacement,3.44,http://ecx.images-amazon.com/images/I/41ct7UAR14L._SX300_.jpg,{'Cell Phones & Accessories': 8995},Apple,"[['Cell Phones & Accessories', 'Accessories', 'Replacement Parts']]"
B008BK8LY8,A2EYRSWX6FJDUO,,"[0, 0]",Has that nice pop feeling like an original and you can just install this right away no hassle of transporting your old button in or anything it works awesome so far.,5.0,1405641600,"07 18, 2014",iPhone 4 4G Black Home Button w/ Flex Cable,2.4,http://ecx.images-amazon.com/images/I/31ioKwdBDLL._SY300_.jpg,{'Cell Phones & Accessories': 1185},Apple,"[['Cell Phones & Accessories', 'Accessories', 'Replacement Parts']]"
B008BK8LY8,A1H62U2FJKAQP8,Aerofool625,"[0, 0]",The ribbon is not accurately shaped to fit in the chassis like the original. A slight contortion is required for it to connect properly. The button itself does not sit flush with the screen and is sunken in slightly. This does not matter to me. It is very responsive and has a good click to it when used. I would purchase this again if needed.,4.0,1370822400,"06 10, 2013",iPhone 4 4G Black Home Button w/ Flex Cable,2.4,http://ecx.images-amazon.com/images/I/31ioKwdBDLL._SY300_.jpg,{'Cell Phones & Accessories': 1185},Apple,"[['Cell Phones & Accessories', 'Accessories', 'Replacement Parts']]"
B008BK8LY8,A2R1SVTWYJOE17,"Angel Girl ""DebbieJo""","[0, 0]",My son thought there was something wrong with the button cause he couldn't get it to stick up as high on the phone as original button but it worked when he got it all together......just is set in lower than normal. We aren't sure what the problem was .......,3.0,1369094400,"05 21, 2013",iPhone 4 4G Black Home Button w/ Flex Cable,2.4,http://ecx.images-amazon.com/images/I/31ioKwdBDLL._SY300_.jpg,{'Cell Phones & Accessories': 1185},Apple,"[['Cell Phones & Accessories', 'Accessories', 'Replacement Parts']]"
B008BK8LY8,AHSX6DAOVQ3QV,Bryan V,"[0, 0]",When I replaced my broken home button it was very lose fit but it worked. I wouldn't recommend this product to anyone..,2.0,1380153600,"09 26, 2013",iPhone 4 4G Black Home Button w/ Flex Cable,2.4,http://ecx.images-amazon.com/images/I/31ioKwdBDLL._SY300_.jpg,{'Cell Phones & Accessories': 1185},Apple,"[['Cell Phones & Accessories', 'Accessories', 'Replacement Parts']]"
B008BK8LY8,A2M9PUWOJUVIVS,Caleb C. Boyle,"[0, 2]",it's a home button so hopefully it will bring me to the homescreen. Seems to be of good quality .,5.0,1375833600,"08 7, 2013",iPhone 4 4G Black Home Button w/ Flex Cable,2.4,http://ecx.images-amazon.com/images/I/31ioKwdBDLL._SY300_.jpg,{'Cell Phones & Accessories': 1185},Apple,"[['Cell Phones & Accessories', 'Accessories', 'Replacement Parts']]"
B008BK8LY8,A2P874GYTED4O7,Chase L.,"[0, 0]",This product does exactly what it is supposed to. Make sure you know what you are doing if you plan on doing the repair yourself.,5.0,1403222400,"06 20, 2014",iPhone 4 4G Black Home Button w/ Flex Cable,2.4,http://ecx.images-amazon.com/images/I/31ioKwdBDLL._SY300_.jpg,{'Cell Phones & Accessories': 1185},Apple,"[['Cell Phones & Accessories', 'Accessories', 'Replacement Parts']]"
B008BK8LY8,A1P5XI3RGOUQDL,DaisyDukes,"[0, 0]",Home button was broken purchased this and it's good as new. It doesn't come with two buttons like in the display photo,5.0,1379980800,"09 24, 2013",iPhone 4 4G Black Home Button w/ Flex Cable,2.4,http://ecx.images-amazon.com/images/I/31ioKwdBDLL._SY300_.jpg,{'Cell Phones & Accessories': 1185},Apple,"[['Cell Phones & Accessories', 'Accessories', 'Replacement Parts']]"
B008BK8LY8,A2VGHT17ERD3RZ,Da Truth,"[0, 0]",received the item today and had a tech install the home button.  works great!  would order more in the future if home button doesn't function properly.,5.0,1395014400,"03 17, 2014",iPhone 4 4G Black Home Button w/ Flex Cable,2.4,http://ecx.images-amazon.com/images/I/31ioKwdBDLL._SY300_.jpg,{'Cell Phones & Accessories': 1185},Apple,"[['Cell Phones & Accessories', 'Accessories', 'Replacement Parts']]"
B008BK8LY8,A26H1ZD3UQLFAD,Dead_catz,"[0, 0]","FIXED my home button problem success, i was having unresponsive home button unless you press hard on it, put this puppy in and its perfect read some of your reviews so i hope it stays that way.it has been months since i installed this home button still working perfectly 5stars",5.0,1352764800,"11 13, 2012",iPhone 4 4G Black Home Button w/ Flex Cable,2.4,http://ecx.images-amazon.com/images/I/31ioKwdBDLL._SY300_.jpg,{'Cell Phones & Accessories': 1185},Apple,"[['Cell Phones & Accessories', 'Accessories', 'Replacement Parts']]"
B008BK8LY8,AWJPMT7VIFIE5,Derek,"[0, 0]","I bought from Electromaster, and although the button was placed a little crooked on the flex cable, it was a simple fix and the button works great.",5.0,1357948800,"01 12, 2013",iPhone 4 4G Black Home Button w/ Flex Cable,2.4,http://ecx.images-amazon.com/images/I/31ioKwdBDLL._SY300_.jpg,{'Cell Phones & Accessories': 1185},Apple,"[['Cell Phones & Accessories', 'Accessories', 'Replacement Parts']]"
B008BK8LY8,AMDPB7ABG8HWE,Felix E. Benitez,"[0, 1]","I does what it is suppose to, the installation was a little long but well worth it. It arrived sooner than expected and in perfect conditions.",5.0,1382054400,"10 18, 2013",iPhone 4 4G Black Home Button w/ Flex Cable,2.4,http://ecx.images-amazon.com/images/I/31ioKwdBDLL._SY300_.jpg,{'Cell Phones & Accessories': 1185},Apple,"[['Cell Phones & Accessories', 'Accessories', 'Replacement Parts']]"
B008BK8LY8,A1DGE7FADRWQO1,Hidaner Ferrer,"[0, 1]","This replacement looks and feels like new, works as described and it arrived on time. Recommended 100% for anyone. Thanks!",5.0,1368403200,"05 13, 2013",iPhone 4 4G Black Home Button w/ Flex Cable,2.4,http://ecx.images-amazon.com/images/I/31ioKwdBDLL._SY300_.jpg,{'Cell Phones & Accessories': 1185},Apple,"[['Cell Phones & Accessories', 'Accessories', 'Replacement Parts']]"
B008BK8LY8,A2M05KVXUEZDDE,JRAW_ILAGAN,"[0, 1]",I dont recommend installing this by yourself if youre not experienced in doing this type of repair but if you want to practice do it with a dummy phone that you may have destroyed. Proceed at your own risk.,5.0,1365120000,"04 5, 2013",iPhone 4 4G Black Home Button w/ Flex Cable,2.4,http://ecx.images-amazon.com/images/I/31ioKwdBDLL._SY300_.jpg,{'Cell Phones & Accessories': 1185},Apple,"[['Cell Phones & Accessories', 'Accessories', 'Replacement Parts']]"
B008BK8LY8,A2NSCZA69AEEYK,Juan,"[0, 0]",good product fits perfect and looks like the original would recommend to anyone who needed would buy another if ever needed,4.0,1384387200,"11 14, 2013",iPhone 4 4G Black Home Button w/ Flex Cable,2.4,http://ecx.images-amazon.com/images/I/31ioKwdBDLL._SY300_.jpg,{'Cell Phones & Accessories': 1185},Apple,"[['Cell Phones & Accessories', 'Accessories', 'Replacement Parts']]"
B008BK8LY8,A1PGBHZ61DDC32,Leroy Jenkins,"[0, 1]",When I replace iphone screens I also replace the home button and this product is perfect 100% recommendable for any do-it-yourselfer or tech!!!,5.0,1367539200,"05 3, 2013",iPhone 4 4G Black Home Button w/ Flex Cable,2.4,http://ecx.images-amazon.com/images/I/31ioKwdBDLL._SY300_.jpg,{'Cell Phones & Accessories': 1185},Apple,"[['Cell Phones & Accessories', 'Accessories', 'Replacement Parts']]"
B008BK8LY8,ABNPEFLS6FZM6,Lord of things awesome,"[0, 0]","I waited 3 weeks for this button, when it finally came the package only contained a plastic button, no flex, no actual switch.",1.0,1388448000,"12 31, 2013",iPhone 4 4G Black Home Button w/ Flex Cable,2.4,http://ecx.images-amazon.com/images/I/31ioKwdBDLL._SY300_.jpg,{'Cell Phones & Accessories': 1185},Apple,"[['Cell Phones & Accessories', 'Accessories', 'Replacement Parts']]"
B008BK8LY8,AQFVJPVA0BBMO,Luo,"[0, 0]","I knew it would be a bit of an uphill battle to install this home button in my iPhone 4.  I got the home button, clearly from China, in a crappy destroyed looking plastic bag.  It works, but its a pretty flimsy junky spare part.One point on installation.  Of course you have to unscrew and take apart your phone.  I actually kind of enjoy doing that, but there is one step that I absolutely do not enjoy...heating the glue under the screen and peeling the screen off of the frame.  Its doable, but it sucks to do.  You will literally have to take your entire phone apart to install this button and no tools are provided with this particular button.  My advice would be if you don't have tools to take apart an iPhone, then buy a button that comes with tools and have your blow drier handy when you begin the installation.  Can't imagine how hard home button replacement is going to be on the iPhone 5s.",3.0,1379808000,"09 22, 2013",iPhone 4 4G Black Home Button w/ Flex Cable,2.4,http://ecx.images-amazon.com/images/I/31ioKwdBDLL._SY300_.jpg,{'Cell Phones & Accessories': 1185},Apple,"[['Cell Phones & Accessories', 'Accessories', 'Replacement Parts']]"
B008BK8LY8,A25RYPHS7AGQ7T,matt,"[0, 1]",now i have a spare button for my iphone. all i needed was the clicker part but it comes with the plastic button glued to the top so now i have an extra one of those 2,5.0,1372464000,"06 29, 2013",iPhone 4 4G Black Home Button w/ Flex Cable,2.4,http://ecx.images-amazon.com/images/I/31ioKwdBDLL._SY300_.jpg,{'Cell Phones & Accessories': 1185},Apple,"[['Cell Phones & Accessories', 'Accessories', 'Replacement Parts']]"
B008BK8LY8,A354Y2E5E41RLA,Mauro A. Rinaldi,"[0, 0]",I replaced my old home button in my iPhone 4 and it worked great! No complaints. And I was a complete rookie in fixing iPhones.,5.0,1359936000,"02 4, 2013",iPhone 4 4G Black Home Button w/ Flex Cable,2.4,http://ecx.images-amazon.com/images/I/31ioKwdBDLL._SY300_.jpg,{'Cell Phones & Accessories': 1185},Apple,"[['Cell Phones & Accessories', 'Accessories', 'Replacement Parts']]"
B008BK8LY8,A11Y9ESK1AWI1K,Noah White,"[0, 0]","Installing the screen with this home button is okay, its hard to not get the cable stuck to the screen adhesive, and its also hard to keep it plugged in while trying to position the home button when putting the screen back in.",4.0,1401840000,"06 4, 2014",iPhone 4 4G Black Home Button w/ Flex Cable,2.4,http://ecx.images-amazon.com/images/I/31ioKwdBDLL._SY300_.jpg,{'Cell Phones & Accessories': 1185},Apple,"[['Cell Phones & Accessories', 'Accessories', 'Replacement Parts']]"
B008BK8LY8,A11Y935X5S2MPW,Pirbogado,"[0, 0]","this product works great, a little had to replace but now my home button feels like a new one, totally satisfied.",5.0,1396051200,"03 29, 2014",iPhone 4 4G Black Home Button w/ Flex Cable,2.4,http://ecx.images-amazon.com/images/I/31ioKwdBDLL._SY300_.jpg,{'Cell Phones & Accessories': 1185},Apple,"[['Cell Phones & Accessories', 'Accessories', 'Replacement Parts']]"
B008BK8LY8,A11WBKXATJ0QRZ,refsheses,"[0, 1]",It doesn't even respond it makes me upset because these is like the life line of the iPhone but i actually waited to long to complain but a replacement would be nice.,1.0,1375056000,"07 29, 2013",iPhone 4 4G Black Home Button w/ Flex Cable,2.4,http://ecx.images-amazon.com/images/I/31ioKwdBDLL._SY300_.jpg,{'Cell Phones & Accessories': 1185},Apple,"[['Cell Phones & Accessories', 'Accessories', 'Replacement Parts']]"
B008BK8LY8,A1QCWS7O7M5P4C,Ruby Houle,"[0, 0]",great replacement fr your phone. i would suggest this to anyone who needs to repace their home button. this works great,5.0,1360195200,"02 7, 2013",iPhone 4 4G Black Home Button w/ Flex Cable,2.4,http://ecx.images-amazon.com/images/I/31ioKwdBDLL._SY300_.jpg,{'Cell Phones & Accessories': 1185},Apple,"[['Cell Phones & Accessories', 'Accessories', 'Replacement Parts']]"
B008BK8LY8,A2GWJ834JQ426A,SunfTheBeach,"[0, 0]",This came and worked great.  I think packaging could use some improvement since there is delicate parts inside.  But Overall a great experience.,3.0,1396396800,"04 2, 2014",iPhone 4 4G Black Home Button w/ Flex Cable,2.4,http://ecx.images-amazon.com/images/I/31ioKwdBDLL._SY300_.jpg,{'Cell Phones & Accessories': 1185},Apple,"[['Cell Phones & Accessories', 'Accessories', 'Replacement Parts']]"
