asin,reviewerID,reviewerName,helpful,reviewText,overall,unixReviewTime,reviewTime,title,price,imUrl,salesRank,brand,categories
B0097BEG1C,A3TNPE6Q4TTN07,"Nils Rasmusson ""White and Nerdy""","[1, 2]","Since the original ear buds were pretty much worthless to me (uncomfortable, poor sound) I was somewhat skeptical of the ear pods. When I got my iPhone 5 and tried out the ear pods, I immediately noticed that these were a whole different product.COMFORT: EXCELLENTThese are comfy headphones. I have been using a pair of Klipsch in-ear headphones for over two years. Unlike the Klipsch and other headphones, these don't actually insert into your ear canal. I figured this would make them similar to the old ear phones that hurt after a very short time but that isn't the case. They sort of just sit comfortably in your ear. They don't need to be pushed in, they fit well and aren't loose and they don' wear on you after an hour or two. They just feel nice and are hardly noticeable, even after four or five hours of use. These are comfortable headphones.SOUND QUALITY: GOODThe design of the ear pods is such that they pack a good amount of quality sound in a small package and without having to cover your ears and without being inserted into your ear canal. The bass on these headphones is actually pretty good. I've had Sennheiser headphones, Bose Triports and others and these aren't as good as those but they're really decent for the size and form factor.FEATURES: AWESOMEOne of my favorite aspects of the ear pods is that I can talk, turn up the volume, turn down the volume, pause my music/Pandora/audiobook/podcast/video and resume my media all without taking the iPhone out of my pocket. That's pretty awesome. The microphone picks up my voice just fine, the volume and action buttons are responsive and extremely useful. These features alone really give the ear pods a huge advantage over the competition, especially if you're using them with an Apple product. I haven't tried them with my iPad 3 yet but I assume they work the same on that.SIZE/CORD: GREATThe size of the ear phones themselves seems great to me. The cord doesn't tangle easily and isn't too long or too short. No complaints here.SUMMARYThis is a pretty wonderful little set of headphones. I was completely uninterested in them when I got my phone. I'm so pleasantly surprised at what a nice addition these are to the iPhone. I haven't used my Sennheisers or Klipsch headphones at all since getting these. Good sound, great features and very comfortable. Nicely done, Apple!",5.0,1350345600,"10 16, 2012",Apple EarPods with Remote and Mic,17.59,http://ecx.images-amazon.com/images/I/21tMVjCzYNL._SY300_.jpg,,Apple,"[['Cell Phones & Accessories', 'Accessories', 'Headsets', 'Wired Headsets']]"
B0097BEG1C,A3O5J43GFTSPSN,Noah,"[0, 0]",I love the sound.  You save a few bucks buying it here instead of the store.  Only drawback is you really get to find out how much earwax you have.  The design of these headphones allow for great sound but also scoop up ear wax.  So you will have to clean them or your ears constantly.,5.0,1376352000,"08 13, 2013",Apple EarPods with Remote and Mic,17.59,http://ecx.images-amazon.com/images/I/21tMVjCzYNL._SY300_.jpg,,Apple,"[['Cell Phones & Accessories', 'Accessories', 'Headsets', 'Wired Headsets']]"
B0097BEG1C,A0720622H67YG6H1K33S,Orlando Chango,"[0, 0]","They really are very good headphones, the quality with which the music is heard is excellent. If you possess a good MP3 player that holds an adjustable equalizer, you'll notice that the headphones can be heard very well. I recommend them.",5.0,1397433600,"04 14, 2014",Apple EarPods with Remote and Mic,17.59,http://ecx.images-amazon.com/images/I/21tMVjCzYNL._SY300_.jpg,,Apple,"[['Cell Phones & Accessories', 'Accessories', 'Headsets', 'Wired Headsets']]"
B0097BEG1C,A18D5L8R123ZKW,Oswaldo Garcia,"[0, 0]",My son loves these and is very happy. I dont much care for them but they work well and are Apple product.,4.0,1381276800,"10 9, 2013",Apple EarPods with Remote and Mic,17.59,http://ecx.images-amazon.com/images/I/21tMVjCzYNL._SY300_.jpg,,Apple,"[['Cell Phones & Accessories', 'Accessories', 'Headsets', 'Wired Headsets']]"
B0097BEG1C,AEI8P01K2VRKF,"paperplanemayne ""yall have a good day ~""","[0, 0]","when I recieved the item, I got the wrong ones and I was disappointed, I emailed them the error, got an immediate response and said I got new ones shipped again. waited for awhile and tracked the shipment. Finally got them, and super happy about it!",5.0,1388361600,"12 30, 2013",Apple EarPods with Remote and Mic,17.59,http://ecx.images-amazon.com/images/I/21tMVjCzYNL._SY300_.jpg,,Apple,"[['Cell Phones & Accessories', 'Accessories', 'Headsets', 'Wired Headsets']]"
B0097BEG1C,A1VTCSCH8FFC76,Parker Hallam,"[1, 1]",I lost the iPod headphones that came with the original pack while traveling and I was disappointed as I was not able to get a perfect match in terms of looks and performance until I found this Earpods with Remote on Amazon. I have never used an earpod with remote before and the whole concept itself was amazing. Considering the fact that I can control my headphones with remote was amazing.The remote was highly helpful while using the headphone on my iPhone as I was able to attend and cut calls easily. The earpods are comfortable and has amazing output.,5.0,1348444800,"09 24, 2012",Apple EarPods with Remote and Mic,17.59,http://ecx.images-amazon.com/images/I/21tMVjCzYNL._SY300_.jpg,,Apple,"[['Cell Phones & Accessories', 'Accessories', 'Headsets', 'Wired Headsets']]"
B0097BEG1C,A1R8RHI9W66EK0,"Patrice M. Mcpeak ""PainterPleinAir""","[0, 0]",These ear pods are the best Apple pods yet. They're comfortable and stay in the ears without popping out like the round version. Finally they got it right!,5.0,1369958400,"05 31, 2013",Apple EarPods with Remote and Mic,17.59,http://ecx.images-amazon.com/images/I/21tMVjCzYNL._SY300_.jpg,,Apple,"[['Cell Phones & Accessories', 'Accessories', 'Headsets', 'Wired Headsets']]"
B0097BEG1C,AO6W812WW0PXY,Patty P.,"[0, 0]","They are very nice, but do not work in my previous generation ipod, but I will just use. I love to come wrapped box where",5.0,1362268800,"03 3, 2013",Apple EarPods with Remote and Mic,17.59,http://ecx.images-amazon.com/images/I/21tMVjCzYNL._SY300_.jpg,,Apple,"[['Cell Phones & Accessories', 'Accessories', 'Headsets', 'Wired Headsets']]"
B0097BEG1C,A1602WP8OHESZD,"P. Mistretta ""Phillip2167""","[0, 0]",i could not believe the bass response that comes out of these tiny earbuds! they sound as good as my $147 dollar bose headphones. butthey still fall out of my ear,5.0,1357171200,"01 3, 2013",Apple EarPods with Remote and Mic,17.59,http://ecx.images-amazon.com/images/I/21tMVjCzYNL._SY300_.jpg,,Apple,"[['Cell Phones & Accessories', 'Accessories', 'Headsets', 'Wired Headsets']]"
B0097BEG1C,A17WA1XU2A2F0M,"Purevsuren Zeidel ""CuriousKitty""","[0, 0]","These headphones are really cool. But I actually bought these for my third generation ipod shuffle. A little shocked that i couldn't control the volume on my ipod with these headphones. But they work fine on my phone, so i am keeping them.",5.0,1364774400,"04 1, 2013",Apple EarPods with Remote and Mic,17.59,http://ecx.images-amazon.com/images/I/21tMVjCzYNL._SY300_.jpg,,Apple,"[['Cell Phones & Accessories', 'Accessories', 'Headsets', 'Wired Headsets']]"
B0097BEG1C,A24BZNA7RKZ04A,Ramiro Marin,"[0, 0]",These ear buds are pretty pricey but they're totally worth the money. They have an AMAZING sound and quality to them.  They have gone through the washer and dryer and still work good as new.,5.0,1383004800,"10 29, 2013",Apple EarPods with Remote and Mic,17.59,http://ecx.images-amazon.com/images/I/21tMVjCzYNL._SY300_.jpg,,Apple,"[['Cell Phones & Accessories', 'Accessories', 'Headsets', 'Wired Headsets']]"
B0097BEG1C,AJU8W50NUO094,Regina Cone,"[0, 0]",When I saw new design of headphones I had my doubts.  Previous versions always hurt my ears after a while.  These headphones/earbuds fit great and they sound better than all of my aftermarket headphones.  What took so long!  The sound quality is great and the ability to change volume and forward songs is great too!,5.0,1357257600,"01 4, 2013",Apple EarPods with Remote and Mic,17.59,http://ecx.images-amazon.com/images/I/21tMVjCzYNL._SY300_.jpg,,Apple,"[['Cell Phones & Accessories', 'Accessories', 'Headsets', 'Wired Headsets']]"
B0097BEG1C,A22BKEOA4GCQWB,Richard W.,"[0, 0]","Nice sound and fits snug in the ear.  If I tried to take these away, she would probably break my arm.",5.0,1369785600,"05 29, 2013",Apple EarPods with Remote and Mic,17.59,http://ecx.images-amazon.com/images/I/21tMVjCzYNL._SY300_.jpg,,Apple,"[['Cell Phones & Accessories', 'Accessories', 'Headsets', 'Wired Headsets']]"
B0097BEG1C,A3TSY2IGMMN166,Robbossee,"[1, 2]","As far as clarity in music, it's pretty good. I wouldn't say it's worth $30 though...Does it fit??Hmmmm, well here is the problem... I really like the idea and concept of these ear buds, but they don't fit very well. I feel silly working out with these cause I have to constantly place the ear bud back into my ear because it isn't a snug fit. Besides ppl wearing sandals to the gym, ear buds falling out my ear in a work out is my BIGGEST pet peeve. Apple... you disappoint me. Always creating ""different"" products but yet again, it fails to deliver.Thank God for my pair of Sonys.",3.0,1352160000,"11 6, 2012",Apple EarPods with Remote and Mic,17.59,http://ecx.images-amazon.com/images/I/21tMVjCzYNL._SY300_.jpg,,Apple,"[['Cell Phones & Accessories', 'Accessories', 'Headsets', 'Wired Headsets']]"
B0097BEG1C,A1MQQEM7W77L62,Robert,"[0, 0]",These are great little ear phones for price. They are genuine Apple Ear Pods. The mic picks up very well; meaning you don't have to talk loud to be heard. You can also control the volume and pause play functions on iPhones/iPods. I sleep with mine in and they tend to stay in. Some people may have problems with that based on their anatomy or if they are a restless sleeper. I shouldn't review the fidelity of them since me ears were damaged by noise in the military. But that being said for me they sound great; and no I don't have to play them really loud. They give good results even at low volumes. Something important about these is that Apple seems to have fixed the insulation; the old ear buds used to stiffen up; which is probably a reaction to skin oils. I've used this model for over a year and haven't seen any of that old problem. I'm hard on mine so I bought two this time; and when I finally break these I'm buy them again. Great Product!,5.0,1404259200,"07 2, 2014",Apple EarPods with Remote and Mic,17.59,http://ecx.images-amazon.com/images/I/21tMVjCzYNL._SY300_.jpg,,Apple,"[['Cell Phones & Accessories', 'Accessories', 'Headsets', 'Wired Headsets']]"
B0097BEG1C,ARIC00M54T1YD,Robert Jones,"[0, 0]","A bit of a background:I have a pair of Sennheiser HD280 pros, a pair of Bose QC's, and up until recently a five year old pair of iPod ear buds.I posted over 1,000 running miles on my trusty old ear buds using the Nike Plus system.  I ran through snow, rain, freezing rain, and wind.  And yes - they even saw a wash/dry cycle or two.  I hated to see them go.After my initial impressions with the earPods, this is my review.Before leaving the house, I compared them sound-wise to an old set of ear buds and my Sennheisers just for laughs.The sound quality is far better on the earPods than the old earBuds, *especially* the bass.  The earPod's response is certainly not ""flat"" sounding, but it does have a multidimensional quality that the earBuds lack.  The sound quality isn't directly comparable to the Sennheisers, but those are over the ear DJ phones at 3x the price.Now, for the running.After mile 2 they started hurting my ears a bit.  I fiddled with them and they got better.  I found I didn't need to rotate them upwards as much for them to stay seated.  I was OK again by mile 3.  They do not fit me like the buds did, so it took some getting used to.  They do lock into place and they don't move.  It was cold, so I didn't sweat very much.  They have to stay in when I sweat - that is an absolute requirement.  I'm going to assume they would be OK based on how well they seated.  They are overall a bit better with not shifting around than the old buds were.Sound-wise, I was simply astounded.  There is no comparison in sound quality of the pods and buds once you get out into the world.  The pods did an amazing job with traffic and cross-winds.  The sound from the pods really cut through, especially support instruments and other sounds not normally ""up front"".  The old buds would get a very washed out sound while running with most background sounds.  Only down an empty dirt road with no wind would the old buds really give you a decent listening experience.  The pods and the buds are not sound blocking devices: you can still hear traffic, but the difference is you can also hear the music and the traffic, not just the traffic.Upon returning I inspected them.  The reason for the ""owie"" is there is a sharp oval edge on the forward pointing part of the device.  They cut into my ear a little bit.  They should look at rounding those off a bit.One more thing to point out - the remote is perfect for adjusting sound.  The sound wheel doesn't work with gloves on, and it can be quite touchy while running, making it difficult to adjust.  The up-down volume next to the ear is perfect.  Now I can hide the iPod away and not mess with it for the whole run.",5.0,1356739200,"12 29, 2012",Apple EarPods with Remote and Mic,17.59,http://ecx.images-amazon.com/images/I/21tMVjCzYNL._SY300_.jpg,,Apple,"[['Cell Phones & Accessories', 'Accessories', 'Headsets', 'Wired Headsets']]"
B0097BEG1C,A1VA41OGO7X0ZW,"Rogelio Altez ""Cheila Salas""","[0, 0]","This came late, they  gave me a refund and I would have gave them an excellent review if it wasn't for the fact that one of the earpods doesn't sound as loud as the other, it's very uncomfortable to use and I stopped using them...",2.0,1386806400,"12 12, 2013",Apple EarPods with Remote and Mic,17.59,http://ecx.images-amazon.com/images/I/21tMVjCzYNL._SY300_.jpg,,Apple,"[['Cell Phones & Accessories', 'Accessories', 'Headsets', 'Wired Headsets']]"
B0097BEG1C,A2NOW4U7W3F7RI,rpv,"[0, 0]","I had a hard time using it, because I was not a in ear person. I eventually returned to my Bose On Ear headphones. I use it mainly in gyms and while running these were not comfortable and kept falling off. JayBird's was the better of the in ear type I had tried, but for me on ear is better even though bulky. (Bose On-Ear Headphones(Old Version)",3.0,1368662400,"05 16, 2013",Apple EarPods with Remote and Mic,17.59,http://ecx.images-amazon.com/images/I/21tMVjCzYNL._SY300_.jpg,,Apple,"[['Cell Phones & Accessories', 'Accessories', 'Headsets', 'Wired Headsets']]"
B0097BEG1C,A2VN32H7VP70IG,"R. Startzman ""Wood Chief""","[0, 0]","I've tried a number of these in- ear listening devices. Some fit snugly and others not and feel like they are going to fall out. The snugger eventually feel uncomfortable, especially on long flights. Noise canceling is barely worth the extra expense as you can hear the counter sound ever so slightly. Little plastic fitting cups don't help much either. These Apple Earpods are in a different category. They fit,at least my ears, perfectly. I don't have to jam them in, only hang them on the base of the ear. The sound is directed to the ear canal in the right direction. Bass comes out very well, much better than other brands. The cords are flexible, but rigid enought to resist tangling. Controls are easy and responsive. No stuffy feeling. Five stars.",5.0,1353801600,"11 25, 2012",Apple EarPods with Remote and Mic,17.59,http://ecx.images-amazon.com/images/I/21tMVjCzYNL._SY300_.jpg,,Apple,"[['Cell Phones & Accessories', 'Accessories', 'Headsets', 'Wired Headsets']]"
B0097BEG1C,A26FD4U2SMC52A,ruel,"[1, 1]","Genuine Apple EarPods are cool to haveJanuary 8, 2013, Review:got these real genuine Apple EarPods as a xmas present for my sister. she loves them. bought the Apple Earpods from Amazon and so they were directly sent from the amazon warehouse. therefore, they are genuine (and NOT some knockoff lookalike earphones). the sound is better on these real genuine Apple Earpods than on the old regular apple earbuds. with the sales tax, the cost was thirty bucks and some change. so it was like directly buying from apple. for me, since buy from amazon most of the time, then this was convenient to get. worthwhile purchase. may get these Apple Earpods for myself if didn't use my bluetooth headphones all the time.April 5, 2013, Review:now got a set of these real genuine Apple EarPods for myself - but this time as a ""Used - Like New"" product from amazon third-party marketplace seller ""House of Stuff"" for fifteen bucks plus shipping. the previous completely new Apple EarPods for my sister that me purchased directly from Amazon a few months ago had cost thirty bucks. my sister's Apple EarPods and my Apple EarPods were both exactly the same, but my sister's EarPods originally came in the fancy Apple retail box, while my ""used"" Apple EarPods, which apparently was an accessory for someone's iPhone 5, wasn't delivered in a fancy retail box. nonetheless, my ""Used - Like New"" Apple EarPods were just as genuine and worked just as well as my sister's bought-as-completely-new Apple EarPods.as a side note, me also recently bought fake clone eight-dollar EarPods that look like the real EarPods - but you can tell the difference. the fake EarPods are flimsy, the fake EarPods are lighter, the fake EarPods' wires are thinner, the parts inside the fake EarPods' earpieces shake, the carrying case for the fake EarPods is lighter, and you have to wind the wires of the fake EarPods clockwise in the carrying case to get everything back in the case (while the wires for the real EarPods have to wind counter-clockwise). the fakes do look good and they can have good okay acceptable sound if you are not too critical, but there is a definite difference when comparing the quality of fake EarPods and the real Apple EarPods.so, based on my buying experience, you have a choice: (1) get the real Apple EarPods for full price at around thirty dollars; or (2) get cheap fake clone EarPods for a lower price of around five-to-ten bucks; or (3) get real Apple EarPods as a used product in the under-twenty dollar price range. my conclusion: you definitely want to get the real Apple EarPods - and not waste your money on fake EarPods.my sister is happy with her Apple EarPods. my fake clone EarPods are going in the car glove compartment as backup earphones for those times when me may forget to bring my bluetooth stereo headphones (or if me forget to bring my real Apple EarPods). and my Apple EarPods go into my daily go-bag of stuff.",5.0,1357603200,"01 8, 2013",Apple EarPods with Remote and Mic,17.59,http://ecx.images-amazon.com/images/I/21tMVjCzYNL._SY300_.jpg,,Apple,"[['Cell Phones & Accessories', 'Accessories', 'Headsets', 'Wired Headsets']]"
B0097BEG1C,A13WXU7Q1VM2S5,RussellC,"[0, 0]","I am a devoted apple user. I have most of the devices. iPhone. iPod, iPad Mini, and a MacBook. The Apple EarPods met and exceeded my expectations. They are definitely a step up from previous versions of there EarPods. the quality of the sound is excellent and they are very comfortable. I have worn them for several hours and never felt any discomfort. If your considering and upgrade for EarPods for any of you Apple devices I would highly recommend these EarPods.",5.0,1368748800,"05 17, 2013",Apple EarPods with Remote and Mic,17.59,http://ecx.images-amazon.com/images/I/21tMVjCzYNL._SY300_.jpg,,Apple,"[['Cell Phones & Accessories', 'Accessories', 'Headsets', 'Wired Headsets']]"
B0097BEG1C,A1FLIYURKY1V7Q,Samantha Brookes,"[1, 1]","there great and all but, i just wish they weren't in such s***y quality. that's my only down fall with them,",3.0,1393459200,"02 27, 2014",Apple EarPods with Remote and Mic,17.59,http://ecx.images-amazon.com/images/I/21tMVjCzYNL._SY300_.jpg,,Apple,"[['Cell Phones & Accessories', 'Accessories', 'Headsets', 'Wired Headsets']]"
B0097BEG1C,A2RVORJ8QXZ772,Sam Boonsakul,"[0, 0]","I've gone through 2 of these in the past year alone.  It is prone to breaking and the fit is weird at first but having grown used to them, I now hold a disdain for in ear earphones.The sound is pretty good for common use.1st pair most likely broke due to blowing it out with full volume for a couple hours (Classical music and I was trying to study whilst people were loudly conversing)2nd pair broke because the rubber casing on the side of the jack tip ripped off and exposed the plastic of the wire at the base to harsher bends which most likely ripped the wire inside. (Sony actually has a great design for this by making the jack perpendicular to the wire head in order to alleviate stress in that location but aesthetics wise I prefer apple's straight jack)Now be warned the warranty that comes with these earphones will not be honored by Apple or atleast so they say and bounced me towards Amazon whilst Amazon will bounce me back to apple until I got fed up enough that I threw an essay at Amazon saying that my first pair broke within a month with no visible signs of damage or water damage.  That pair that I got replaced died on me within the first month and the second pair lasted me about 9 months.So I may plan on buying a pair directly from an apple store with a proof of purchase (ie receipt) so that my warranty will be honored without the whole fuss.",3.0,1383350400,"11 2, 2013",Apple EarPods with Remote and Mic,17.59,http://ecx.images-amazon.com/images/I/21tMVjCzYNL._SY300_.jpg,,Apple,"[['Cell Phones & Accessories', 'Accessories', 'Headsets', 'Wired Headsets']]"
B0097BEG1C,AZ1NSCXQKRGUH,Sam,"[0, 0]",It is a great product and the sound quality is great......besides it's apple product where can you go wrong right,5.0,1376438400,"08 14, 2013",Apple EarPods with Remote and Mic,17.59,http://ecx.images-amazon.com/images/I/21tMVjCzYNL._SY300_.jpg,,Apple,"[['Cell Phones & Accessories', 'Accessories', 'Headsets', 'Wired Headsets']]"
B0097BEG1C,A1KUKFI8NWFT57,Samwize the brave,"[0, 0]","unfortunately this does not fit comfortably for many people. Also, it does not work at all with my Moto RAZR MAXX, which is very disappointing. I have to use my old buds with my work phone, if it were my personal phone I would have given a lower rating.",4.0,1369353600,"05 24, 2013",Apple EarPods with Remote and Mic,17.59,http://ecx.images-amazon.com/images/I/21tMVjCzYNL._SY300_.jpg,,Apple,"[['Cell Phones & Accessories', 'Accessories', 'Headsets', 'Wired Headsets']]"
B0097BEG1C,A2MAJK49M3CBIY,"Score Event ""TimeTraveler""","[0, 0]","I have used a lot of earbuds over the past 5 or 6 years with IPods and IPads, ranging from cheap $10.00 sets to the well over $100.00 ones.  I never cared for the old Apple earbuds , both because they do not fit well and they sound lousy.  I had heard that these new EarPods were a drastic improvement so at $29.00 I figured it was worth checking them out.  These are a different shape that previous Apple earbuds, and different from any others I have used.  The fit is still not perfect but far better than the old ones.  But the sound, especially the bass, is to my ears, better than  any of the other earbuds I have used, including the $100+ sets.  I highly recommend these.  At the price I don't think there is anything that can beat them.",5.0,1349136000,"10 2, 2012",Apple EarPods with Remote and Mic,17.59,http://ecx.images-amazon.com/images/I/21tMVjCzYNL._SY300_.jpg,,Apple,"[['Cell Phones & Accessories', 'Accessories', 'Headsets', 'Wired Headsets']]"
B0097BEG1C,A1VO1ZUXG3PDNH,Scorpio93p,"[0, 0]",these are not the original ear pods don't waste your money these sound awful. No bass or anything on this.,2.0,1376956800,"08 20, 2013",Apple EarPods with Remote and Mic,17.59,http://ecx.images-amazon.com/images/I/21tMVjCzYNL._SY300_.jpg,,Apple,"[['Cell Phones & Accessories', 'Accessories', 'Headsets', 'Wired Headsets']]"
B0097BEG1C,A24M6ISPA5J8RC,Sean,"[0, 0]","I received the EarPods a lot sooner than I expected after losing my own a few days prior. Upon opening the small package, I immediately noticed the casing they were securely in didn't have the apple logo on the back and upon further inspection of the headphones themselves, there's definitely a difference in quality compared to the real thing (the imitation headphones are stiff and the sound quality is not on par with the real thing).",2.0,1377129600,"08 22, 2013",Apple EarPods with Remote and Mic,17.59,http://ecx.images-amazon.com/images/I/21tMVjCzYNL._SY300_.jpg,,Apple,"[['Cell Phones & Accessories', 'Accessories', 'Headsets', 'Wired Headsets']]"
B0097BEG1C,A340U69W7V2LUG,sheeshjackie,"[0, 0]","Inexpensive but still work great, took a little while to come in but worth it! Comes in a little plastic case which is neat.",5.0,1367366400,"05 1, 2013",Apple EarPods with Remote and Mic,17.59,http://ecx.images-amazon.com/images/I/21tMVjCzYNL._SY300_.jpg,,Apple,"[['Cell Phones & Accessories', 'Accessories', 'Headsets', 'Wired Headsets']]"
B0097BEG1C,A30AHOHJCFOIJ9,Shirley Turner,"[0, 0]","I ordered these because I prefer to use my driving time for work conversation... these fit the bill.  Easy in the ears and good volume.  I really the mic, people on the other end can hear me just fine.  The remote is simple to use.  I would buy again...very happy with my choice.  Although I rely on other Amazon reviewers to assist me in my selection of items.",5.0,1358380800,"01 17, 2013",Apple EarPods with Remote and Mic,17.59,http://ecx.images-amazon.com/images/I/21tMVjCzYNL._SY300_.jpg,,Apple,"[['Cell Phones & Accessories', 'Accessories', 'Headsets', 'Wired Headsets']]"
