asin,reviewerID,reviewerName,helpful,reviewText,overall,unixReviewTime,reviewTime,title,price,imUrl,salesRank,brand,categories
B004ZLV5UE,A3HNJRHXIFN97X,William,"[16, 19]","The Apple iPhone 4 is one of Verizon's best all around smartphones.  While it no longer sets the pace in the smartphone realm, the iPhone 4 does an adequate job of handling nearly all basic smartphone tasks and offers well rounded performance; which is all that many smartphone users really want from their device.  While it is not for everyone, and no device is, the iPhone 4 is a solid device and is definitely worth a look for non-power smartphone users.1. Design.1. The compact and svelte design of the iPhone 4 is refreshing, as the smartphone ecosystem continues to evolve from ""brick"" to ""cinder block"" sized phones.  It is slim and pocketable, and the side keys are arranged in an intuitive manner.  Volume keys and the power button (which doubles as a screen lock) are very tactile, and the ring/vibrate toggle on the top left side of the phone is a great addition.  While the phone's physical appearance is subject to personal taste, i'd wager few would find the phone unattractive.  I have the white version of the phone, and find it much more vibrant and visibly appealing than the more unassuming black version, though some may find the white to be too loud on the eyes.2. Despite the phone's relatively small size compared to other smartphones, there's a bit too much wasted space on the front of the phone for my liking.  While the screen is clear and bright (there is no pixelation whatsoever due to the 960x640 resolution), it's a tad small when considering the width and length of the device.  In fairness, problems due to the screen's size are more a product of the operating system and not the physical dimensions of the screen, but the OS also has no relation to empty space on the phone's front face.3. Both the front and rear facing camera's are flush with the phone's design, which is a big plus.  Apple also hit the correct layout for the charging/data port and the 3.5 mm headset jack; the former is located on the bottom of the phone, while the latter is at the top.  Several phones i've used (feature and smart, and from almost every manufacturer) had the headset port on the bottom, which is fine if you like to hold your phone upside down all the time, and also featured charging ports in the middle of the left or right side of the phone.  If Apple changes anything about the physical design of the next iPhone, these two items should not up for discussion.4. One thing that should be up for discussion however, is the back of the phone: it is made out of glass.  Many iPhone 4 users lament this, but Steve Jobs didn't amass a fortune by mistake.  The more people that drop the phone and break the glass on the back, the more money Apple makes.  It's a design flaw, even if it was intentional.Performance1. Calls: I tested the iPhone 4 on Verizon's network in a variety of locations across Louisiana.  Call quality has been very good; I have not encountered any dropouts or conversational blips during any call.  Callers do not sound overly warm through the earpiece, but they do not sound robotic either.  Callers also sounded good through the included headset and on three different bluetooth headsets I tried, but speakerphone quality was abysmal at best.  The speakerphone is not loud enough and suffers from ""the wax paper effect.""2. Reception: the iPhone 4 gets above average reception on Verizon's network; like many Verizon phones, I generally have 3-4 bars nearly everywhere I travel.  It rarely has full signal but I haven't dropped below two bars either.3. Battery Life: the battery will take you through a day of heavy usage and two days of light usage.  Phone calls use surprisingly little power, and I only lose 2-3% of juice while the phone is on standby during the night.4. Data Speeds: While this varies from location to location, I find that the iPhone 4 isn't as quick in this regard as other phone's i've used, particularly Blackberry and Android devices.  Depending on the location, I generally get about 10-20% slower speeds on average with the iPhone 4.  In fairness, I've observed the same with my fiancee's iPhone 4 on At&t;, so it's not a carrier issue.  Regardless, I haven't had any problems loading large webpages, streaming audio and video, and moving files.  In the two areas I spend the most of my time in, my download speeds range from 0.6 to 1.4 MB, and my upload from 0.5 to 0.8 MB, which is normal for many Verizon phones in many locations.  With that being said, it is clear that Verizon's 3G network is slowly clogging up, which i'm hoping the influx of 4G upgrades and devices will address.  Despite these notations, Verizon's 3G network is far more consistent in terms of speed and connection than other carriers in the area. My fiancee's iPhone 4 on At&t; ranges anywhere from 150 KB to 3 MB down and 50 KB to 1 MB up, and even though At&t; theoretically has a faster 3G network than Verizon, my data connection seems far more reliable.Features:1. Operating System: After using several smartphones with different operating systems, i've concluded they are all more or less the same with a few differences here and there: tap an icon on the screen and go.  Up front, I don't find the iPhone 4's OS any easier or harder to use than Android, RIM, WebOS, and Windows Phone 7, and I also don't buy into the idea that iOS is simpler and easier to use than those offered by its competitors.  There are a few differences here and there; Android offers widgets, Blackberry offers a few home screen icons and a drop down menu, and Apple offers...a convoluted mess of icons and programs with little rhyme or reason.  It's simple to use, but that does not mean it is always pleasant.  A drop down menu would do wonders for this OS.  Personally, I miss the widgets than Android and Windows Mobile offer, but I understand Apple cannot become too much like its competitors (well, maybe not until OS 5).  However, there is little organization going on when you first fire up the screen.Where iOS really begins to look like every other OS is when you delve deeper into the menu.  Again, there is little rhyme or reason to how anything is arranged, and for a couple of weeks until you memorize where every option is located, it can be a frustrating experience.  My favorite example was browser settings; you cannot access them from the browser, but only from the overall settings menu itself.  Is this any better or worse than other OS?  No.  Is it any easier though?  Well, no again.A final side note: iOS does not require ""babysitting"" and constant attention like Android does in order to get your battery through the day.  I know rooting solves many of Android's babysitting issues, but a lot of people have jobs, families, and other hobbies that make rooting an unnecessary annoyance.  While I personally like Android OS better for the customization it offers, the entire babysitting/rooting issue is a turn off to some, and I myself don't miss them either (even though I never had a problem rooting an Android device).2. Business functions: Apple does not have the business reputation of RIM or even Android yet, but nothing from my usage suggests it is inferior to either OS in this regard.  Push e-mail works like a charm, Exchange works as it should, and Office files along with PDF's open and render as they should.  I am not a power business user and cannot offer comment on such, but the iPhone 4 gets the basics down in this category.3. Multimedia: This is a big of a mixed bag for me.  The iPhone's 4 camera is one of the best i've ever used on a smartphone; both the rear and front facing.  Though the rear camera is only 5MP, images are clear, sharp, and beautiful as long as there is adequate light.  Night shots with flash were less than stellar, which should surprise no one with a smartphone.  The front facing camera is only 1.3 MP, but still takes images with little distortion.  Beyond this, i'm not blown away with the iPhone 4's multimedia capabilities.  iTunes integrates files nicely with the phone, but i'm not sold that Apple's ecosystem is any better than dragging and dropping.  The iPod is perhaps the most underwhelming feature on the phone; I find it no different or more impressive than any other smartphone music player on any other device.  And the speakerphone performed no more impressively for music and video playback than it did for voice calls; multimedia audio sounded waxed over and washed out on the speaker. The AppStore will only impress those migrating from RIM, WM7, and WebOS.  But one thing I've noticed about using applications on the iPhone 4 is that they don't seem to crash nearly as often as they do on Android and Blackberry, and in fact, I don't think i've had even a handful of them in a month's usage.  And the lack of Flash does not seem to be a hindrance on the phone's multimedia capabilities; QuickTime handles things well, and the YouTube app helps too.  Again, multimedia is a mixed bag on the iPhone 4, but that's more a knock on the hype the device receives rather than the device itself.Conclusion:Other than subtle differences in the OS, the iPhone 4 offers the same similar features that many other smartphones offer.  It does a good job of handling core functions and basic business needs, and its multimedia package is somewhat overblown, yet still more than adequate.  If your looking for a mid sized smartphone that requires little maintenance and don't need LTE services, the iPhone 4 is definitely worth a look.  For the price however, it offers few features that stand apart from any of the other top smartphones in Verizon's lineup.",4.0,1310169600,"07 9, 2011",Apple iPhone 4 16GB (Black) - CDMA Verizon,178.0,http://ecx.images-amazon.com/images/I/41eVAfYDANL._SX300_.jpg,{'Cell Phones & Accessories': 505},Apple,"[['Cell Phones & Accessories', 'Cell Phones', 'No-Contract Cell Phones', 'Phones']]"
B004ZLV5VS,A6DRCYV4WLKJ,alexus,"[3, 3]",its perfect i have no prolbems everyone should buy products off amazon they never let me down and always have the best of everything,5.0,1370476800,"06 6, 2013",Apple iPhone 4 32GB (Black) - Verizon,204.95,http://ecx.images-amazon.com/images/I/41eVAfYDANL._SX300_.jpg,{'Cell Phones & Accessories': 1949},Apple,"[['Cell Phones & Accessories', 'Cell Phones', 'Unlocked Cell Phones']]"
B004ZLV5VS,AN4ALUMJTDX3Z,C. Hjort,"[0, 0]","I had my iphone 4 for 2 years and treated it really well.  Had a case on it and everything.  I decided to trade it in.  All it had were 2 very minor little scratches on the back.  The front was flawless. The ""third party"" came back and gave it the lowest possible rating. Their reasoning was that it was heavily scratched. Not Acceptable at all! Way to take my money and run with it. I could have traded it in with VZW and got $150 for it even if the phone was all scratched up. Giving me $65 is not cool!",1.0,1350950400,"10 23, 2012",Apple iPhone 4 32GB (Black) - Verizon,204.95,http://ecx.images-amazon.com/images/I/41eVAfYDANL._SX300_.jpg,{'Cell Phones & Accessories': 1949},Apple,"[['Cell Phones & Accessories', 'Cell Phones', 'Unlocked Cell Phones']]"
B004ZLV5VS,A26SNF4E4MXL6G,Joe,"[1, 1]",Got a great deal on this but the battery has very shortage which is why I replaced an older version,1.0,1402272000,"06 9, 2014",Apple iPhone 4 32GB (Black) - Verizon,204.95,http://ecx.images-amazon.com/images/I/41eVAfYDANL._SX300_.jpg,{'Cell Phones & Accessories': 1949},Apple,"[['Cell Phones & Accessories', 'Cell Phones', 'Unlocked Cell Phones']]"
B004ZLV5VS,A2O3IIHH24UF8L,Ryan McCarty,"[0, 0]","I like love my new Iphone, had an issue activating it at first cause the Verizob lady told me it was through US Cellular but I got it all taken care of.",5.0,1365638400,"04 11, 2013",Apple iPhone 4 32GB (Black) - Verizon,204.95,http://ecx.images-amazon.com/images/I/41eVAfYDANL._SX300_.jpg,{'Cell Phones & Accessories': 1949},Apple,"[['Cell Phones & Accessories', 'Cell Phones', 'Unlocked Cell Phones']]"
B004ZLV5VS,A2SXN1BL26SHLO,Steve Folsom,"[3, 3]","32 GB really made the difference for me - more music, more apps and it was in perfect condition.  Thanks Folks",5.0,1395187200,"03 19, 2014",Apple iPhone 4 32GB (Black) - Verizon,204.95,http://ecx.images-amazon.com/images/I/41eVAfYDANL._SX300_.jpg,{'Cell Phones & Accessories': 1949},Apple,"[['Cell Phones & Accessories', 'Cell Phones', 'Unlocked Cell Phones']]"
B004ZLYBQ4,A2OR4QUQSUMOW7,A. Brinskele,"[1, 2]","This is a fantastic device! I have seen so many reviews of this phone that I wanted to just specifically address something ignored or not noticed about it by most of the people I have known who have one.  The headphones are special to the phone and they come with a tiny mic in the cord that hangs down by your neck. You can raise or lower the volume here (look for the plus and minus signs) but you can also hang up a call by pressing the center between the volume buttons.  Also, if you hang up a call and then want to listed to some music, you don't have to touch the phone you can just hit that center button again and a song will start playing (using that center section)using the play/pause!I have heard the newest model are shaped differently and smaller too.",5.0,1353715200,"11 24, 2012",Apple iPhone 4 16GB (White) - Verizon,180.0,http://ecx.images-amazon.com/images/I/41ua5HiV45L._SY300_.jpg,{'Cell Phones & Accessories': 711},Apple,"[['Cell Phones & Accessories', 'Cell Phones', 'Unlocked Cell Phones']]"
B004ZLYBQ4,A7S2T9FBK5FG2,"Caballo ""Jorge""","[0, 0]","I was stock on a bad contract and not able to upgrade my device until November 2015. I was thinking buying something new until I saw this IPhone for $250.00 Of course it&#8217;s free with a 2 year contract from Verizon, but not for me and a bad contract. I was paying full price or getting stock with my 4 year old device. Well, got my phone, call Verizon to activate. Everything was done over the phone. Updated the operating system and I can't be happier. There are plenty of accessories for this iPhone so I got me the Lifeproof cover and clip for less on Amazon, and I have to tell you, life it&#8217;s good with my IPhone 4. Battery Keeps the charge and I get almost all the features from the IPhone 5.",5.0,1387324800,"12 18, 2013",Apple iPhone 4 16GB (White) - Verizon,180.0,http://ecx.images-amazon.com/images/I/41ua5HiV45L._SY300_.jpg,{'Cell Phones & Accessories': 711},Apple,"[['Cell Phones & Accessories', 'Cell Phones', 'Unlocked Cell Phones']]"
B004ZLYBQ4,A2OSLSA2JA6WXB,Kay Chitwood,"[1, 1]",Love the iPhone. Have had no problems. Just can't keep my teenager off it long enough to talk to her. Would not have bought her another phone.,5.0,1384300800,"11 13, 2013",Apple iPhone 4 16GB (White) - Verizon,180.0,http://ecx.images-amazon.com/images/I/41ua5HiV45L._SY300_.jpg,{'Cell Phones & Accessories': 711},Apple,"[['Cell Phones & Accessories', 'Cell Phones', 'Unlocked Cell Phones']]"
B004ZLYBQ4,A8AUDTPBNSMJO,Kimberly,"[1, 1]",I cannot get enough of this phone.  I carry it everywhere I go now.  I just need to set the ringtone to my favorite song.,5.0,1398729600,"04 29, 2014",Apple iPhone 4 16GB (White) - Verizon,180.0,http://ecx.images-amazon.com/images/I/41ua5HiV45L._SY300_.jpg,{'Cell Phones & Accessories': 711},Apple,"[['Cell Phones & Accessories', 'Cell Phones', 'Unlocked Cell Phones']]"
B004ZLYBQ4,A3A8TNF7XZA2EO,KitsuneUdon,"[1, 2]","I expect quality for the price I pay, and this iphone didn't let me down. I like the phone and won't change it anytime soon.",5.0,1370390400,"06 5, 2013",Apple iPhone 4 16GB (White) - Verizon,180.0,http://ecx.images-amazon.com/images/I/41ua5HiV45L._SY300_.jpg,{'Cell Phones & Accessories': 711},Apple,"[['Cell Phones & Accessories', 'Cell Phones', 'Unlocked Cell Phones']]"
B004ZLYBQ4,AU4OW17TRDV03,"llgk ""llgk""","[0, 1]","The iPhone 4 is an amazing phone.. Never force closes... Crisp clear display, fast processor, and haven't had a dropped call yet... So it's much better than my Verizon Droid X or my Sprint Evo.  I recommend this phone to anyone who wants a great &#34;apple&#34; experience.",4.0,1373846400,"07 15, 2013",Apple iPhone 4 16GB (White) - Verizon,180.0,http://ecx.images-amazon.com/images/I/41ua5HiV45L._SY300_.jpg,{'Cell Phones & Accessories': 711},Apple,"[['Cell Phones & Accessories', 'Cell Phones', 'Unlocked Cell Phones']]"
B004ZLYBQ4,AMHSC9CJ6K6QQ,Mishell Magnusson,"[0, 0]",Received exactly as advertised and works super. Very pleased with the product and the price.  I only put four stars because I don't feel you can &#34;love&#34; a product.,4.0,1381449600,"10 11, 2013",Apple iPhone 4 16GB (White) - Verizon,180.0,http://ecx.images-amazon.com/images/I/41ua5HiV45L._SY300_.jpg,{'Cell Phones & Accessories': 711},Apple,"[['Cell Phones & Accessories', 'Cell Phones', 'Unlocked Cell Phones']]"
B004ZLYBQ4,A1S5B0F180YGCX,Noah,"[0, 0]","its an iphone, what is there not to love. . . . . . . . . . . .",5.0,1362614400,"03 7, 2013",Apple iPhone 4 16GB (White) - Verizon,180.0,http://ecx.images-amazon.com/images/I/41ua5HiV45L._SY300_.jpg,{'Cell Phones & Accessories': 711},Apple,"[['Cell Phones & Accessories', 'Cell Phones', 'Unlocked Cell Phones']]"
B004ZLYBQ4,A3RUPEHQ1DIXUW,Ravishing Redhead,"[1, 1]","This was my first iPhone after having the Samsung Galaxy and I will say- they are both beautiful phones and have their pro's and con's but, for someone like myself that just wants a phone for basic things and is easy to use...this is the phone for you.  I am very happy with it!",5.0,1391385600,"02 3, 2014",Apple iPhone 4 16GB (White) - Verizon,180.0,http://ecx.images-amazon.com/images/I/41ua5HiV45L._SY300_.jpg,{'Cell Phones & Accessories': 711},Apple,"[['Cell Phones & Accessories', 'Cell Phones', 'Unlocked Cell Phones']]"
B004ZLYBQ4,A2VN32H7VP70IG,"R. Startzman ""Wood Chief""","[6, 9]","This is an Apple product. What more is there to say? A giant improvement over my DROID, a good smart phone by itself, but no Apple. Apple's iOS is easy to use and works flawlessly. iCloud keeps all my gadgets in sync. Siri pretty much does what she is advertised to do (with a few hiccups.) Supposedly Siri is in beta and I expect really great things from her when the real version is finished. Apple accomplished a formidible task when they developed an AI-based voice recognition system that works with natural language as opposed to numerous competitor's requirements to remember an assortment of code words like ""dial"" and ""call."" If someone tells you that Siri isn't revolutionary, don't believe them.The only weak point as far as my personal (reasonably heavy) use is concerned is battery life.  The battery barely makes it through the day. A post 5.0 iOS release helped a bit, but it's still not enough for me so I bought a BOOST case so I don't have to worry about running out of juice.",4.0,1325116800,"12 29, 2011",Apple iPhone 4 16GB (White) - Verizon,180.0,http://ecx.images-amazon.com/images/I/41ua5HiV45L._SY300_.jpg,{'Cell Phones & Accessories': 711},Apple,"[['Cell Phones & Accessories', 'Cell Phones', 'Unlocked Cell Phones']]"
B004ZLYBQ4,A2P6VHQQIOGRK5,"s.haulk77 ""S.M. Haulk""","[5, 5]",This does exactly what it is suppose to do so I have no complaints at this time. Great phone for a great price!,5.0,1362441600,"03 5, 2013",Apple iPhone 4 16GB (White) - Verizon,180.0,http://ecx.images-amazon.com/images/I/41ua5HiV45L._SY300_.jpg,{'Cell Phones & Accessories': 711},Apple,"[['Cell Phones & Accessories', 'Cell Phones', 'Unlocked Cell Phones']]"
B004ZLYBQ4,A1BY8VZJVSKDHQ,TyLK,"[2, 4]","I love iphones. I needed one quickly and at a low price after mine was stolen. The phone came right on time. I was upset about the long crack at the bottom of the screen and the phone was dirty around the home button and the switch on the side. Other than that , the phone worked well. I haven't had any problems so far.",3.0,1357948800,"01 12, 2013",Apple iPhone 4 16GB (White) - Verizon,180.0,http://ecx.images-amazon.com/images/I/41ua5HiV45L._SY300_.jpg,{'Cell Phones & Accessories': 711},Apple,"[['Cell Phones & Accessories', 'Cell Phones', 'Unlocked Cell Phones']]"
B004ZLYBQ4,A1HBI9BBQIG1NH,Ward J. Lamb,"[0, 0]","The phone looked BRAND NEW and works GREAT! The phone was in the original box and everything looked straight out of the factory, I am completely thrilled with the shipping and handling. My iPhone 5 from verizon cracked and I had no insurance this phone I purchased because the price of purchasing an even older version of the iPhone 5 ( like the iPhone 4 ) at this great price is very difficult to find- at the Verizon store it is more than double the price ! Purchasing this phone was a life and money saver! Thank you!!",5.0,1389657600,"01 14, 2014",Apple iPhone 4 16GB (White) - Verizon,180.0,http://ecx.images-amazon.com/images/I/41ua5HiV45L._SY300_.jpg,{'Cell Phones & Accessories': 711},Apple,"[['Cell Phones & Accessories', 'Cell Phones', 'Unlocked Cell Phones']]"
B00598BY6W,AWGHZJVJ7CY2Q,Abel,"[0, 0]",Yo ya tengo un Iphone 4 S y he comprado este otro para regal&aacute;rselo a mi sobrino. El tel&eacute;fono llego tal como lo hab&iacute;a pactado el vendedor. Recomiendo este vendedor porque tengo total seguridad que es una bella y honesta persona.,5.0,1344729600,"08 12, 2012",Apple iPhone 4 16GB (A1332) - GSM Factory Unlocked - No Warranty (Black),269.99,http://ecx.images-amazon.com/images/I/51WGZcaPztL._SY300_.jpg,{'Cell Phones & Accessories': 1357},Apple,"[['Cell Phones & Accessories', 'Cell Phones', 'Unlocked Cell Phones']]"
B00598BY6W,A1M9671AL0KID8,Albert Biagini,"[1, 1]",I'm not hip to all the new features of the newer iphones but for what I use it for it's just great. I paid $320 and it worth every penny. I got service with no contract and I love it. The MMS doesn't work with every service check the iphone website before you pick a service.,5.0,1394582400,"03 12, 2014",Apple iPhone 4 16GB (A1332) - GSM Factory Unlocked - No Warranty (Black),269.99,http://ecx.images-amazon.com/images/I/51WGZcaPztL._SY300_.jpg,{'Cell Phones & Accessories': 1357},Apple,"[['Cell Phones & Accessories', 'Cell Phones', 'Unlocked Cell Phones']]"
B00598BY6W,A30XE5RHZPTM6D,Arch,"[1, 1]","The iPhone came in excellent condition, works fluently with no problem, the case wasn't the same as apple but who cares the phone works.",5.0,1387065600,"12 15, 2013",Apple iPhone 4 16GB (A1332) - GSM Factory Unlocked - No Warranty (Black),269.99,http://ecx.images-amazon.com/images/I/51WGZcaPztL._SY300_.jpg,{'Cell Phones & Accessories': 1357},Apple,"[['Cell Phones & Accessories', 'Cell Phones', 'Unlocked Cell Phones']]"
B00598BY6W,A3GQZO7IS2FDGG,"BiG-SaVeR ""Nazrett""","[0, 1]","I buy repair and sell iPhones, I also buy the unlock for my customers and make sure their iPhone is factory unlocked, sometimes I see an already unlocked iPhones coming to me for unlock due to lack of knowledge of bypassing the iTune activation window after the phone was restored, If your iPhone is Unlocked please don't hesitate to setup iTune/apple store account, sometimes it's life sever, although there are some other way to go around activation, the easiest way is to connect your iPhone to iTune and activate it after restoring it to factory setting.If you couldn't pass activation window it doesn't mean your iPhone is NOT Unlocked, the only way you will know wheather or not is is unlocked is if you will manage to pass that screen and try to use a none AT&T; in US Case SIM and it gives you ""SIM Card Failure"" I just had an iPhone on my desk last night from one of my customers who couldn't pass activation window so he had to pay $20+ to unlock it. Let us be open to the challanges technology brings to us before blaming some sellers.",5.0,1354060800,"11 28, 2012",Apple iPhone 4 16GB (A1332) - GSM Factory Unlocked - No Warranty (Black),269.99,http://ecx.images-amazon.com/images/I/51WGZcaPztL._SY300_.jpg,{'Cell Phones & Accessories': 1357},Apple,"[['Cell Phones & Accessories', 'Cell Phones', 'Unlocked Cell Phones']]"
B00598BY6W,A3LWV4B2ZTBDQ0,Camman,"[0, 1]","What are you taking about a refb it is a used phone, but the problems are fixed by a dealer.",4.0,1362182400,"03 2, 2013",Apple iPhone 4 16GB (A1332) - GSM Factory Unlocked - No Warranty (Black),269.99,http://ecx.images-amazon.com/images/I/51WGZcaPztL._SY300_.jpg,{'Cell Phones & Accessories': 1357},Apple,"[['Cell Phones & Accessories', 'Cell Phones', 'Unlocked Cell Phones']]"
B00598BY6W,A386I2UKJMME0Q,Endii,"[3, 3]","I would like to say my experience with my new phone is amazing!!! One method I found it  best was to talk to the seller about the phone before buying it. Its better than asking questions under the question forum where one half of the people have had a bad product and the other half have had a good one. Its hard to determine whether you'll get a good product or a bad product by  somebody's own experience. I recommend talking to the seller, they were kind and were very accurate with their product. The seller I recommend is Put Group USA. They seem to be doing pretty good but I had to check for myself. People had been getting locked phones. Mines was unlocked, all i needed to do was insert my T-Mobile sim card. People claimed when updating to ios 7 the phone ran slow. My phone remained the same, it works perfectly. Its not slow at all. The problem is also don't always go with the used phones, because although they may claim they are in perfectly good condition when they tend to be messed with. Just go with Put Group USA, and talk to them first. You won't waste your money :)",5.0,1391731200,"02 7, 2014",Apple iPhone 4 16GB (A1332) - GSM Factory Unlocked - No Warranty (Black),269.99,http://ecx.images-amazon.com/images/I/51WGZcaPztL._SY300_.jpg,{'Cell Phones & Accessories': 1357},Apple,"[['Cell Phones & Accessories', 'Cell Phones', 'Unlocked Cell Phones']]"
