asin,reviewerID,reviewerName,helpful,reviewText,overall,unixReviewTime,reviewTime,title,price,imUrl,salesRank,brand,categories
B00FB2XNCE,A2PSC7LUNIDEAH,Dmitry Kristal,"[2, 3]","I was torn between this and Galaxy 2, but not anymore.  Not only is Sony much cheaper and suits me better, but as of April, 2014, you can now change the wallpaper, similar to Galaxy 2 watches.  Overall I think this smartwatch is better suitable for me than Galaxy 2 and here is why:Battery lasts longer:  Two plus days of moderate use and it still keeps on ticking.  Charging it everyday would make it feel like another device rather than a watch.  I wasn't a fan of wearing a watch, but I am now.Charging:  To charge this, simply connect it to any USB-powered outlet or computer.  Galaxy 2 offers a complicated dongle and because I'll have to charge it more often, it would become a hassle.Less is more:  I realize that with Galaxy 2 I can take pictures and use it as a speakerphone, but do I need that?  First off, taking a picture with your watch will make you look downright creepy at times and I'm sure with time, more public places will notice and restrict the use of it(like gym.)  While talking through a watch might be handy at some point, do I really need to look like a Power Ranger on a street?Thinner:  Sony is thinner by design and as I've mentioned before, it was important for me to have a swartwatch that resembles a more traditional discreet watch rather than a &#34;look at me I'm a futuristic device watch.&#34;Cheaper:  If you get the right deal, this watch can cost you almost two times less than Galaxy 2 and because I do not eat caviar for breakfast nor own a diamond-studded swimming pool, this is important to me as well.Please note that I am not putting Galaxy 2 down.  I'm a fan of both brands.  I own a Galaxy phone and a tablet, which is why I was so torn, but Sony2 suited my lifestyle better.  Both devices are great and it all depends what you need a smartwatch for that should be the deciding factor.",5.0,1398556800,"04 27, 2014",Sony Smart Watch SW2 for Android Phones,141.37,http://ecx.images-amazon.com/images/I/41BbpnSrRRL._SY300_.jpg,{'Cell Phones & Accessories': 2452},Sony,"[['Cell Phones & Accessories', 'Accessories', 'Smart Watches & Accessories'], ['Clothing, Shoes & Jewelry', 'Jewelry: International Shipping Available'], ['Electronics', 'Computers & Accessories', 'Computer Components']]"
B00FB2XNCE,A6I8KXYK24RTB,D. Stein,"[1, 1]","I bought a Pebble Steel via pre-order the day it was announced and waited with anticipation for it's arrival.  Only to be really let down.  It didn't seem to do too much, it was horribly uncomfortable, and my poor aging eyes just couldn't read the screen.  I found myself pulling my phone out anyway.  So I sold the Pebble and decided this whole watch thing wasn't for me.  I really don't know what got me to buy this Sony watch, but it has certainly surprised me.  It does more than the Pebble, it's faster, looks better, has about the same battery life, and is actually quite comfortable.  I'm still scratching my head as to why this watch hasn't enjoyed a lot more success, particularly among the tech/geek crowd.  Perhaps my getting into it well after the initial release allowed the software to mature and improve.",4.0,1402444800,"06 11, 2014",Sony Smart Watch SW2 for Android Phones,141.37,http://ecx.images-amazon.com/images/I/41BbpnSrRRL._SY300_.jpg,{'Cell Phones & Accessories': 2452},Sony,"[['Cell Phones & Accessories', 'Accessories', 'Smart Watches & Accessories'], ['Clothing, Shoes & Jewelry', 'Jewelry: International Shipping Available'], ['Electronics', 'Computers & Accessories', 'Computer Components']]"
B00FB2XNCE,A31FSS0Z5P3GHE,fierfaerie,"[7, 11]",Item arrived damaged.  Small scraches around face.... But I can see how easily the face scratches!!!  Really really not worth it!,1.0,1388880000,"01 5, 2014",Sony Smart Watch SW2 for Android Phones,141.37,http://ecx.images-amazon.com/images/I/41BbpnSrRRL._SY300_.jpg,{'Cell Phones & Accessories': 2452},Sony,"[['Cell Phones & Accessories', 'Accessories', 'Smart Watches & Accessories'], ['Clothing, Shoes & Jewelry', 'Jewelry: International Shipping Available'], ['Electronics', 'Computers & Accessories', 'Computer Components']]"
B00FB2XNCE,A2507ZYWGMY9BK,Gcat,"[6, 7]","The typical way to check a notification on your phone is to pull it out of your pocket, hit the power button, swipe to unlock, and swipe to see the notifications. There are many situations where going through this process is rude, dangerous, and/or difficult such as driving a car, riding a bike, doing construction work, sitting in a meeting, carrying a bag of groceries, holding your child's hand, etc. If you get tens to hundreds of notifications throughout the day, having a notification device on your wrist can be a huge benefit.I've been using the Sony Smartwatch2 for a couple months and it generally does the job well. Notifications and phone calls display automatically on the watch face without requiring the push of any buttons. About 10-20 words can be displayed on the watch which is generally enough to tell if you want to deal with it now or later. You can even read an entire email on the watch without a button press by just swiping up.The Smartwatch2 is very limited in terms of customization or settings. While more flexibility would be nice, it is not a huge deal to me because I just want the watch to do its job as a notifier and not try to be a mini-Android device. I purposely keep my watch bare-bones as far as apps so as to not cause any problems. Certain apps like the calendar app are buggy anyway.One of the best features is that it charges via universal micro-USB. If you are considering a smartwatch, you likely already have micro-USB chargers all over the place. The battery life is pretty good. If you turn off your watch at night, it will last a few days between charges.Another nice feature is the non-proprietary watchband which can accept any 24mm generic band. This allows easy customization or replacement of a broken band.There are some negatives with this watch which can be annoying:*The range of this watch could be a lot better. The watch needs to be within about 20 feet from your phone. This is a Bluetooth limitation so it's not really the phone's fault. The lack of range means that if you are walking around your house without the phone in your pocket, you will be going in and out of range all the time. Every time you go in or out of range, the watch vibrates. This gets annoying fast and will cause you to think you are getting notifications when you are not.If you are right around the outer limits of the range, the Smartwatch2 may vibrate constantly as it pairs and un-pairs every few seconds. This happens to me all the time when I'm sitting on my couch watching TV and my phone is in an adjacent room. There is no way to turn off this vibration notification as far as I know. (Note: This issue has been resolved with an update.)I hope future generations of the watch can connect to my home network so I can get notifications anywhere in my house.*There is no way to tell if your Smartwatch2 is actively paired or not. A small LED on the outside of the watch to signal the pairing status would be a great help.I researched other smartwatch options prior to purchase but felt the Sony version suited me the best. The Galaxy Gear and the Pebble use a proprietary charger which is a huge negative. The Galaxy Gear is more expensive, not as universally compatible, and has much less battery life.Overall, the Sony Smartwatch2 works well as a pure notification device. It does its job effortlessly and reliably (as long your phone is in range), and the battery doesn't require frequent recharging. As long as you aren't expecting much more than that, you will be happy.UPDATE: I would strongly recommend the ""Find Phone"" app which allows you to locate your phone even if it is on silent mode.UPDATE April 2014: A new software update allows you to disable the connected/disconnected vibration notification. The watchface is also more customizable. Both good upgrades.",4.0,1390262400,"01 21, 2014",Sony Smart Watch SW2 for Android Phones,141.37,http://ecx.images-amazon.com/images/I/41BbpnSrRRL._SY300_.jpg,{'Cell Phones & Accessories': 2452},Sony,"[['Cell Phones & Accessories', 'Accessories', 'Smart Watches & Accessories'], ['Clothing, Shoes & Jewelry', 'Jewelry: International Shipping Available'], ['Electronics', 'Computers & Accessories', 'Computer Components']]"
B00FB2XNCE,A381AI1X2V6RA8,jc,"[1, 1]",Great piece I use this watch everyday..battery lady about a week charges real fast.i needed a water proof watch which this does great. . My only issue I had which could be bad and was is the band gave me major rash.so I guess I'm allergic to it so had to just put a barrier in between the watch and my skin.. (duct tape) for temporary. Will have to order a watch band on line. People alway comment on it all the time.,5.0,1396137600,"03 30, 2014",Sony Smart Watch SW2 for Android Phones,141.37,http://ecx.images-amazon.com/images/I/41BbpnSrRRL._SY300_.jpg,{'Cell Phones & Accessories': 2452},Sony,"[['Cell Phones & Accessories', 'Accessories', 'Smart Watches & Accessories'], ['Clothing, Shoes & Jewelry', 'Jewelry: International Shipping Available'], ['Electronics', 'Computers & Accessories', 'Computer Components']]"
B00FB2XNCE,A2T7HX60WDRGIF,Jeremy Redmond,"[3, 3]","I bought this watch after doing some research on the various smartwatchs available and I have been pretty happy with it. My main reason for having it is because I am not allowed to have my phone out at work but with this I can keep up with any text messages, facebook posts, and see if and who is calling when my phone is on silent.Pros:-Takes a standard micro USB to charge not a cumbersome cradle.- Is compatible with all android phones unlike samsungs smartgear.- This watch gives you the option to change the wrist band, I have already changed it out to a steel band.- gives a great quick view of alerts from your cell phone- Recent update allows you to adjust the watch face to your liking- Great price, not even a $10,000 Rolex can do half of the stuff this can doCons:- Should have the option to show the weather on the watch face without 3rd party apps- Having too many apps on the device slows it down and causes it to constantly drop connection- battery is only good for maybe two days, but should be charged every night to be sure.- Should have a clear all function for the alertsI am looking forward to the new line of android watches being developed with the new Google now OS but for now due to the price and compatibility I find this one to be top dog.",4.0,1398211200,"04 23, 2014",Sony Smart Watch SW2 for Android Phones,141.37,http://ecx.images-amazon.com/images/I/41BbpnSrRRL._SY300_.jpg,{'Cell Phones & Accessories': 2452},Sony,"[['Cell Phones & Accessories', 'Accessories', 'Smart Watches & Accessories'], ['Clothing, Shoes & Jewelry', 'Jewelry: International Shipping Available'], ['Electronics', 'Computers & Accessories', 'Computer Components']]"
B00FB2XNCE,AMYPFNBARJLYB,Joe B,"[0, 0]","It is a very handy device.  It just needs to have more apps for it.  It is rather limited for the time being.  Battery lasts for days, it is comfortable.I enjoy it.",4.0,1396915200,"04 8, 2014",Sony Smart Watch SW2 for Android Phones,141.37,http://ecx.images-amazon.com/images/I/41BbpnSrRRL._SY300_.jpg,{'Cell Phones & Accessories': 2452},Sony,"[['Cell Phones & Accessories', 'Accessories', 'Smart Watches & Accessories'], ['Clothing, Shoes & Jewelry', 'Jewelry: International Shipping Available'], ['Electronics', 'Computers & Accessories', 'Computer Components']]"
B00FB2XNCE,A2K54E9UJTNIQZ,Jonah Sturgeon,"[0, 0]","I really like this watch. It has a nice interface, and looks stylish for a smartwatch. You can download third party apps for it, so you can get email and snapchat notifications. You can even download a keyboard so you can text on it. All in all, for a watch that works on any Android phone, it is very nice. I would recommend if you want to get a nice, cheap smartwatch.",5.0,1403049600,"06 18, 2014",Sony Smart Watch SW2 for Android Phones,141.37,http://ecx.images-amazon.com/images/I/41BbpnSrRRL._SY300_.jpg,{'Cell Phones & Accessories': 2452},Sony,"[['Cell Phones & Accessories', 'Accessories', 'Smart Watches & Accessories'], ['Clothing, Shoes & Jewelry', 'Jewelry: International Shipping Available'], ['Electronics', 'Computers & Accessories', 'Computer Components']]"
B00FB2XNCE,A56AUIA2KJ3KQ,Jonathan C. Ross,"[0, 1]","I tried this with three different phones....Moto X, worked flawlessly, not problems whatsoeverHTC One M8, it didn't want to stay connected, it kept saying connected, disconnected, connected, disconnected every minute of so...Galaxy S4, worked flawlessly....I think this is an overlooked item in most peoples book. For the price, it's 1000% better than my Pebble ever can be, and it looks slick.Functionality wise, everything syncs and worked well with my phone, there were plenty of options as far as other apps go, and they all seem to work well. No complaints on that department.Its all a matter of personal decision. This does work well and does what it's suppose to do and looks good doing so...",4.0,1397606400,"04 16, 2014",Sony Smart Watch SW2 for Android Phones,141.37,http://ecx.images-amazon.com/images/I/41BbpnSrRRL._SY300_.jpg,{'Cell Phones & Accessories': 2452},Sony,"[['Cell Phones & Accessories', 'Accessories', 'Smart Watches & Accessories'], ['Clothing, Shoes & Jewelry', 'Jewelry: International Shipping Available'], ['Electronics', 'Computers & Accessories', 'Computer Components']]"
B00FB2XNCE,A3CSZGXOQMPY3P,"Jonathan Morales ""deitiphobia""","[48, 54]","I tried out the Samsung Galaxy Gear smartwatch but after a few days returned it and decided to try the Sony SmartWatch 2. This review is a bit of a comparison of the two watches. I hands down prefer the SmartWatch 2 over the Galaxy Gear for several reasons.1) The strength of this watch is that it isn't trying to be everything. Because of that, the price is now 1/2 of what the Galaxy Gear cost and that makes this watch a very good value.2) Don't sweat the lack of camera or speaker phone that the galaxy gear has. The camera was gimicky on the Galaxy Gear and unnecessary. The speakerphone while useful at times in the Galaxy gear, is not something I miss at all now that I've switched to the SmartWatch 2.3) I think the Sony SmartWatch 2 looks better than the Gear. It has a subtlely handsome look and an understated quality feel and appearance to it. You can wear this watch with almost anything and it would not clash or draw attention to.4) I got a few compliments from women and men about my watch the first day I wore it to work. No one has any clue it's a smartwatch at first and just think it looks cool. The Galaxy Gear I thought was more eye catching in a way I didn't like or want.5) The display on the SmartWatch 2 is always showing the time. I love it! The GG has the display off until you bring up your wrist up in front of you to look at the time, then it would delay for an awkward second, before the screen turns on and you can see the time. The SmartWatch 2 is easy to tell the time at any time.6) I work in a hospital and must do constant hand washing. The SmartWatch 2 is waterproof, while the Galaxy Gear is not. I was very afraid to splash water on the GG and it drove me nuts as I don't have time while working to have to worry about drying my watch all the time or trying to protect it from splashes.7) The screen on the SmartWatch looks just fine. It's not as sharp as the GG screen, but it doesn't matter. You can easily read many rows of tiny text on the screen when receiving longer messages. Yes you can see pixels up but so what. It's still perfectly decent display for the use case.8. The SmartWatch UI acts just like Android device. There are back, home and menu keys. There is a swipe down gesture that brings down notifications.9. The black rubber watch band is very comfortable in all day use. I couldn't say that about the Galaxy Gear at all. The Galaxy Gear irritated my wrist throughout a days. Part of the metal clasp of the Gear watch band would rub against my wrist and caused me irritation. Also you can replace the SmartWatch band with any watchband.10. My suggestion is to NOT load a lot of useless apps for use on the Watch. I only install the free &#34;WatchIt!&#34; notification app, along with the gmail and text apps. The WatchIt app will allow you to send any notification that appears on the top of your mobile phone to the watch as well. I started off by blacklisting all apps so they DON'T show notifications. Then I go through and approve only the ones I want. Be conservative in what apps you allow to buzz you on your watch. It will get annoying quickly if you allow dumb stuff to bother you and buzz your wrist all day.11. You'll want the stock text message app as it allows you to view and reply to text messages using preformatted replies. You can create your own pre-formatted replies. I deleted all of the stock pre-formatted replies and created my own. When you get a text alert on the watch, you press the menu button, and then the text message icon button to reply. Then you can swype left or right to cycle between your preset replies. It works pretty well and doesn't try and shove more functionality that just won't work on a smartphone.12. The watch does what it's supposed to do. I can view the time at all times, and it lets me get notifications to my wrist so I don't have to pull out my phone at work (which we have a strict no cell phone policy at work). I don't miss any important calls or text or emails anymore. I know when I have to step outside and deal with a call or text and when it can just wait.",4.0,1386028800,"12 3, 2013",Sony Smart Watch SW2 for Android Phones,141.37,http://ecx.images-amazon.com/images/I/41BbpnSrRRL._SY300_.jpg,{'Cell Phones & Accessories': 2452},Sony,"[['Cell Phones & Accessories', 'Accessories', 'Smart Watches & Accessories'], ['Clothing, Shoes & Jewelry', 'Jewelry: International Shipping Available'], ['Electronics', 'Computers & Accessories', 'Computer Components']]"
B00FB2XNCE,AZOK5STV85FBJ,"Kaelan ""frontier_ranger""","[0, 0]","I used this watch for about 4 months now to give it a real world evaluation.-Pros- light and unobtrusive- battery lasts for a few days- customizable- easy to charge with a micro usb-Cons- People will keep asking why you didnt get a galaxy gear- not the best in direct sunlightI bought this item for a few simple reasons. I needed a way to see if I was missing a call or message while on motorcycle/ loud car such as a convertible. It works very well for that. Feel the vibration, look down and see the type of alert. If I have my phone in my pocket, i set it to silent, and then am able to reject calls if I am in a meeting without even taking my phone from my pocket.Sony has released two updates since I have owned this watch. First update allowed me to create my own watch face layouts as well as other tweaks. Second update within the last week now allows me to set my own image as the background.I started out getting all alerts sent to my watch, but I am now down to only Gmail, text messages, and phone calls. You can respond to texts, but only from pre-set responses and you can pre-create your own. Helpful for the motorcycle when i can just tap &#34;on my way&#34; or &#34;sorry, i am currently riding my motorcycle and will call you later&#34;.It does not have a built in camera, but does allow remote viewing of your phone camera. Resolution isnt too high, but it does allow for remotely taken group pics with you in them. I use it at work to see network port numbers in really hard to see areas.I compared it to my cousins galaxy gear watch, and his clearly wins, I could buy over two of these for what he paid vs what I paid. He was shocked that mine could just charge off of the same charger the phone uses, his needs a special device.  If you are looking for a do it all gadget to shove in peoples faces, get the galaxy gear, if you want a sensible watch that happens to have apps, alerts you to notifications, and still has people coming up to you asking &#34;Omg, is that one of those smart watches?!&#34; for half the price of the other one, get the Sony.",5.0,1405468800,"07 16, 2014",Sony Smart Watch SW2 for Android Phones,141.37,http://ecx.images-amazon.com/images/I/41BbpnSrRRL._SY300_.jpg,{'Cell Phones & Accessories': 2452},Sony,"[['Cell Phones & Accessories', 'Accessories', 'Smart Watches & Accessories'], ['Clothing, Shoes & Jewelry', 'Jewelry: International Shipping Available'], ['Electronics', 'Computers & Accessories', 'Computer Components']]"
B00FB2XNCE,A2ZGDRH48UBXFN,King James,"[5, 8]","Initially, I was was set on buying the Galaxy Gear smart watch and so I went to my local Best Buy to get one.  Fortunately, for me they did not have any in stock and said that if I wanted one I would need to wait a week or so to get one.  Nonetheless, there was a few display watches that I could play with.  I tried the Galaxy Gear on and immediately noticed the how bulky it was on my wrist.  Moreover, it wasn't as stylish in person as I had thought it to be, and it looked awkward to the point that I knew that every time someone looked at my wrist, I would have to explain what the hell the thing on my wrist was.  I don't have time like that in my day.  So the next day I saw that Sony would be releasing its new smartwatch, the Sony Smartwatch 2.  It was 100 dollars cheaper and it looked much more like a watch rather than a device on my wrist.  I also found out that it was water resistant where I could wear it in the shower and could wear it while washing dishes.  The main selling point for me on this watch was the amount of time that a charge could be held without having to recharge the watch (around 2-3 days).  Moreover, this was a third generation product, meaning that there were 2 other previous older versions of the watch that Sony could improve on, which meant they had developed more apps for the watch plus the watch would work with any Android phone running 4.0 or better so if I wanted to change phones I could do that without having to think about my watch being obsolete.  All these benefits were things that the Samsung Galaxy Gear could not provide me.  With that being said, I went into a Sony store and bought a black one with a metal band that costs 20 dollars extra. Overall, I would say that I am somewhat satisfied with the product.  Satisfied in the sense that it is a watch and its stylish, something that a watch should be.  Also, as advertised the phone holds excellent time between charges and the notifications come in pretty much on cue. And, its useful when driving when you can't check your phone, because one can also make calls from the watch, very useful when the phone is connected to the car via bluetooth.  What I don't like about the watch is that it lacks a music app so that I can run Pandora or Spotify through it, apps which I use frequently use.  Instead it gives you a generic Google music app which is very laggy and is very limited.  Additionally, occasionally the watch freezes up and when its functional the watch frequently doesn't respond to swipes making you swipe numerous times for the watch to function.  Further, the bluetooth range is limited to about 25-30 feet max.  So if you live in a bigger home then expect your watch to drop in and out of connection frequently.  It also can't answer calls on your phone from the watch unless you have a bluetooth head set or a Sony smartphone, which kind of annoyed me.  Overall, as a watch the Smartwatch is still expensive, but when compared to the Galaxy Gear, is a more practical and functional device.  I didn't need a video camera/camera on my watch unless I: 1. needed to cheat on a test 2. do something perverted with it.  Additionally I didn't want to look stupid answering my phone from my wrist and talking to my wrist.  So I believe I made the right choice between the two.  But, unless you really want a smart watch I would advise you to wait for Apple or Google to take a shot at it so you can make a better decision, because the smart watch market is limited as of now.",3.0,1383264000,"11 1, 2013",Sony Smart Watch SW2 for Android Phones,141.37,http://ecx.images-amazon.com/images/I/41BbpnSrRRL._SY300_.jpg,{'Cell Phones & Accessories': 2452},Sony,"[['Cell Phones & Accessories', 'Accessories', 'Smart Watches & Accessories'], ['Clothing, Shoes & Jewelry', 'Jewelry: International Shipping Available'], ['Electronics', 'Computers & Accessories', 'Computer Components']]"
B00FB2XNCE,A15SGFFV68SQ98,Lisa,"[1, 1]","My husband loves, loves, loves this watch. It is clear and easy to see. You can easily see who is calling, get weather and read texts without reaching for your phone. It also vibrates when you get too far from your phone which is AWESOME because my husband kept forgetting his phone when we went anywhere. I was a little reluctant to purchase because of the price, but not that we have had it for awhile, I think it was a great deal and we got our money's worth.",5.0,1388448000,"12 31, 2013",Sony Smart Watch SW2 for Android Phones,141.37,http://ecx.images-amazon.com/images/I/41BbpnSrRRL._SY300_.jpg,{'Cell Phones & Accessories': 2452},Sony,"[['Cell Phones & Accessories', 'Accessories', 'Smart Watches & Accessories'], ['Clothing, Shoes & Jewelry', 'Jewelry: International Shipping Available'], ['Electronics', 'Computers & Accessories', 'Computer Components']]"
